,Start Date,Start Price,End Date,End Price,Weekly Returns,Bin Label,News,Basics
0,2023-01-08,120.14850616455078,2023-01-15,118.60675048828125,-0.012832083606249767,D2,[],{}
1,2023-01-15,118.60675048828125,2023-01-22,114.37680053710938,-0.035663652648419975,D4,[],{}
2,2023-01-22,114.37680053710938,2023-01-29,118.08296203613281,0.032403087703270606,U4,"[{""date"": ""20230123232300"", ""headline"": ""Ross Stores Inc. stock outperforms competitors on strong trading day"", ""summary"": ""Looking for stock market analysis and research with proves results? Zacks.com offers in-depth financial research with over 30years of proven results.""}, {""date"": ""20230124232300"", ""headline"": ""Ross Stores Inc. stock rises Wednesday, outperforms market"", ""summary"": ""Looking for stock market analysis and research with proves results? Zacks.com offers in-depth financial research with over 30years of proven results.""}, {""date"": ""20230125033000"", ""headline"": ""dd's DISCOUNTS to Open a New Store in San Jose, California"", ""summary"": ""Looking for stock market analysis and research with proves results? Zacks.com offers in-depth financial research with over 30years of proven results.""}, {""date"": ""20230125074700"", ""headline"": ""Watch these retailers as the most likely to nab sales from closing Bed Bath & Beyond stores"", ""summary"": ""Looking for stock market analysis and research with proves results? Zacks.com offers in-depth financial research with over 30years of proven results.""}, {""date"": ""20230125232300"", ""headline"": ""Ross Stores Inc. stock rises Thursday, still underperforms market"", ""summary"": ""Looking for stock market analysis and research with proves results? Zacks.com offers in-depth financial research with over 30years of proven results.""}, {""date"": ""20230126033000"", ""headline"": ""dd's DISCOUNTS to Open a New Store in Canoga Park, California"", ""summary"": ""Looking for stock market analysis and research with proves results? Zacks.com offers in-depth financial research with over 30years of proven results.""}, {""date"": ""20230126232300"", ""headline"": ""Ross Stores Inc. stock underperforms Friday when compared to competitors"", ""summary"": ""Looking for stock market analysis and research with proves results? Zacks.com offers in-depth financial research with over 30years of proven results.""}, {""date"": ""20230127033000"", ""headline"": ""dd's DISCOUNTS to Open a New Store in Joliet, Illinois"", ""summary"": ""Looking for stock market analysis and research with proves results? Zacks.com offers in-depth financial research with over 30years of proven results.""}, {""date"": ""20230129050100"", ""headline"": ""2 Stocks Near All-Time Highs Worth Buying Now"", ""summary"": ""Ross Stores\u00a0(NASDAQ: ROST) stock is 9% off its all-time high, while TXJ Companies\u00a0(NYSE: TJX) has set new highs regularly in recent trading days. Are they set up for a recession crash? While there's always the risk of volatility, Motley Fool contributors Jason Hall and Tyler Crowe explain why they're set up for strong continued success and should keep rewarding investors for years to come, even from these near-record stock prices.""}]","{""assetTurnoverTTM"": 1.4129, ""bookValue"": 4288, ""cashRatio"": 1.2519251925192518, ""currentRatio"": 1.8991, ""ebitPerShare"": 1.6322, ""eps"": 1.3059, ""ev"": 38883.43, ""fcfMargin"": 0.188, ""fcfPerShareTTM"": 3.0184, ""grossMargin"": 0.247, ""inventoryTurnoverTTM"": 6.5093, ""longtermDebtTotalAsset"": 0.1831, ""longtermDebtTotalCapital"": 0.3642, ""longtermDebtTotalEquity"": 0.5729, ""netDebtToTotalCapital"": -0.3106, ""netDebtToTotalEquity"": -0.4885, ""netMargin"": 0.0857, ""operatingMargin"": 0.1071, ""payoutRatioTTM"": 0.2853, ""pb"": 9.5565, ""peTTM"": 27.1039, ""pfcfTTM"": 26.2447, ""pretaxMargin"": 0.1115, ""psTTM"": 2.1919, ""quickRatio"": 1.2957, ""receivablesTurnoverTTM"": 141.1004, ""roaTTM"": 0.1143, ""roeTTM"": 0.3639, ""roicTTM"": 0.2288, ""rotcTTM"": 0.3012, ""salesPerShare"": 15.2328, ""sgaToSale"": 0.753, ""totalDebtToEquity"": 0.5729, ""totalDebtToTotalAsset"": 0.1831, ""totalDebtToTotalCapital"": 0.3642, ""totalRatio"": 1.4698, ""period"": ""2023-01-28""}"
3,2023-01-29,118.08296203613281,2023-02-05,113.97159576416016,-0.03481760790108401,D4,"[{""date"": ""20230129050100"", ""headline"": ""2 Stocks Near All-Time Highs Worth Buying Now"", ""summary"": ""Ross Stores\u00a0(NASDAQ: ROST) stock is 9% off its all-time high, while TXJ Companies\u00a0(NYSE: TJX) has set new highs regularly in recent trading days. Are they set up for a recession crash? While there's always the risk of volatility, Motley Fool contributors Jason Hall and Tyler Crowe explain why they're set up for strong continued success and should keep rewarding investors for years to come, even from these near-record stock prices.""}, {""date"": ""20230130030000"", ""headline"": ""Dividend Cut Risk For Tanger But SWAN With Simon"", ""summary"": ""In this article, we share a high yield at risk of cutting its dividend as well as one that is very likely to sustain theirs. See if SKT or SPG, which is best.""}, {""date"": ""20230130033000"", ""headline"": ""dd's DISCOUNTS to Open its First Wisconsin Store in Milwaukee"", ""summary"": ""Looking for stock market analysis and research with proves results? Zacks.com offers in-depth financial research with over 30years of proven results.""}, {""date"": ""20230130122200"", ""headline"": ""Ross Stores Inc. stock falls Monday, still outperforms market"", ""summary"": ""Shares of Ross Stores Inc. shed 0.41% to $119.00 Monday, on what proved to be an all-around grim trading session for the stock market, with the S&P 500 Index...""}, {""date"": ""20230131033000"", ""headline"": ""dd's DISCOUNTS to Open a New Store in Laurel, Maryland"", ""summary"": ""Looking for stock market analysis and research with proves results? Zacks.com offers in-depth financial research with over 30years of proven results.""}, {""date"": ""20230131122100"", ""headline"": ""Ross Stores Inc. stock falls Tuesday, underperforms market"", ""summary"": ""Shares of Ross Stores Inc. slipped 0.68% to $118.19 Tuesday, on what proved to be an all-around positive trading session for the stock market, with the S&P...""}, {""date"": ""20230201033000"", ""headline"": ""dd's DISCOUNTS to Open a New Store in Houston, Texas"", ""summary"": ""Looking for stock market analysis and research with proves results? Zacks.com offers in-depth financial research with over 30years of proven results.""}, {""date"": ""20230201122200"", ""headline"": ""Ross Stores Inc. stock rises Wednesday, still underperforms market"", ""summary"": ""Shares of Ross Stores Inc. inched 0.28% higher to $118.52 Wednesday, on what proved to be an all-around positive trading session for the stock market, with...""}, {""date"": ""20230202033000"", ""headline"": ""dd's DISCOUNTS to Open a New Store in Fort Myers, Florida"", ""summary"": ""Looking for stock market analysis and research with proves results? Zacks.com offers in-depth financial research with over 30years of proven results.""}, {""date"": ""20230202122100"", ""headline"": ""Ross Stores Inc. stock falls Thursday, underperforms market"", ""summary"": ""Shares of Ross Stores Inc. shed 2.05% to $116.09 Thursday, on what proved to be an all-around mixed trading session for the stock market, with the S&P 500...""}, {""date"": ""20230203024700"", ""headline"": ""Right Tail Capital Q4 2022 Investor Letter"", ""summary"": ""Looking for stock market analysis and research with proves results? Zacks.com offers in-depth financial research with over 30years of proven results.""}, {""date"": ""20230203033000"", ""headline"": ""dd's DISCOUNTS to Open a New Store in Merrillville, Indiana"", ""summary"": ""Looking for stock market analysis and research with proves results? Zacks.com offers in-depth financial research with over 30years of proven results.""}, {""date"": ""20230203033400"", ""headline"": ""Right Tail Capital - Ross Stores:\ufffd\ufffd Creating Tremendous Value Per Dollar Of Investment"", ""summary"": ""Looking for stock market analysis and research with proves results? Zacks.com offers in-depth financial research with over 30years of proven results.""}, {""date"": ""20230203122200"", ""headline"": ""Ross Stores Inc. stock outperforms market despite losses on the day"", ""summary"": ""Shares of Ross Stores Inc. dropped 0.66% to $115.32 Friday, on what proved to be an all-around rough trading session for the stock market, with the S&P 500...""}]","{""assetTurnoverTTM"": 1.4129, ""bookValue"": 4288, ""cashRatio"": 1.2519251925192518, ""currentRatio"": 1.8991, ""ebitPerShare"": 1.6322, ""eps"": 1.3059, ""ev"": 38883.43, ""fcfMargin"": 0.188, ""fcfPerShareTTM"": 3.0184, ""grossMargin"": 0.247, ""inventoryTurnoverTTM"": 6.5093, ""longtermDebtTotalAsset"": 0.1831, ""longtermDebtTotalCapital"": 0.3642, ""longtermDebtTotalEquity"": 0.5729, ""netDebtToTotalCapital"": -0.3106, ""netDebtToTotalEquity"": -0.4885, ""netMargin"": 0.0857, ""operatingMargin"": 0.1071, ""payoutRatioTTM"": 0.2853, ""pb"": 9.5565, ""peTTM"": 27.1039, ""pfcfTTM"": 26.2447, ""pretaxMargin"": 0.1115, ""psTTM"": 2.1919, ""quickRatio"": 1.2957, ""receivablesTurnoverTTM"": 141.1004, ""roaTTM"": 0.1143, ""roeTTM"": 0.3639, ""roicTTM"": 0.2288, ""rotcTTM"": 0.3012, ""salesPerShare"": 15.2328, ""sgaToSale"": 0.753, ""totalDebtToEquity"": 0.5729, ""totalDebtToTotalAsset"": 0.1831, ""totalDebtToTotalCapital"": 0.3642, ""totalRatio"": 1.4698, ""period"": ""2023-01-28""}"
4,2023-02-05,113.97159576416016,2023-02-12,113.8332290649414,-0.0012140454671273337,D1,"[{""date"": ""20230206122200"", ""headline"": ""Ross Stores Inc. stock outperforms market on strong trading day"", ""summary"": ""Shares of Ross Stores Inc. inched 0.34% higher to $115.71 Monday, on what proved to be an all-around grim trading session for the stock market, with the S&P...""}, {""date"": ""20230206203900"", ""headline"": ""Retail sector dips as earnings jitters for holiday quarter come into play"", ""summary"": ""Looking for stock market analysis and research with proves results? Zacks.com offers in-depth financial research with over 30years of proven results.""}, {""date"": ""20230206214900"", ""headline"": ""Bed Bath & Beyond`s debt woes puts nearly $6 billion in property bonds in focus"", ""summary"": ""Looking for stock market analysis and research with proves results? Zacks.com offers in-depth financial research with over 30years of proven results.""}, {""date"": ""20230207104800"", ""headline"": ""Bed Bath & Beyond's debt woes puts nearly $6 billion in property bonds in focus"", ""summary"": ""Bed Bath & Beyond's debt woes are putting a spotlight on nearly $6 billion worth of commercial mortgage bonds with exposure to its stores, according to a...""}, {""date"": ""20230207122100"", ""headline"": ""Ross Stores Inc. stock underperforms Tuesday when compared to competitors"", ""summary"": ""Shares of Ross Stores Inc. slipped 1.05% to $114.49 Tuesday, on what proved to be an all-around positive trading session for the stock market, with the S&P...""}, {""date"": ""20230207232300"", ""headline"": ""Ross Stores Inc. stock remains steady Wednesday, still outperforms market"", ""summary"": ""Looking for stock market analysis and research with proves results? Zacks.com offers in-depth financial research with over 30years of proven results.""}, {""date"": ""20230208232200"", ""headline"": ""Ross Stores Inc. stock outperforms competitors on strong trading day"", ""summary"": ""Looking for stock market analysis and research with proves results? Zacks.com offers in-depth financial research with over 30years of proven results.""}, {""date"": ""20230209232300"", ""headline"": ""Ross Stores Inc. stock rises Friday, still underperforms market"", ""summary"": ""Looking for stock market analysis and research with proves results? Zacks.com offers in-depth financial research with over 30years of proven results.""}, {""date"": ""20230211230300"", ""headline"": ""Are retailers finally wrangling inventory issues?"", ""summary"": ""Looking for stock market analysis and research with proves results? Zacks.com offers in-depth financial research with over 30years of proven results.""}]","{""assetTurnoverTTM"": 1.4129, ""bookValue"": 4288, ""cashRatio"": 1.2519251925192518, ""currentRatio"": 1.8991, ""ebitPerShare"": 1.6322, ""eps"": 1.3059, ""ev"": 38883.43, ""fcfMargin"": 0.188, ""fcfPerShareTTM"": 3.0184, ""grossMargin"": 0.247, ""inventoryTurnoverTTM"": 6.5093, ""longtermDebtTotalAsset"": 0.1831, ""longtermDebtTotalCapital"": 0.3642, ""longtermDebtTotalEquity"": 0.5729, ""netDebtToTotalCapital"": -0.3106, ""netDebtToTotalEquity"": -0.4885, ""netMargin"": 0.0857, ""operatingMargin"": 0.1071, ""payoutRatioTTM"": 0.2853, ""pb"": 9.5565, ""peTTM"": 27.1039, ""pfcfTTM"": 26.2447, ""pretaxMargin"": 0.1115, ""psTTM"": 2.1919, ""quickRatio"": 1.2957, ""receivablesTurnoverTTM"": 141.1004, ""roaTTM"": 0.1143, ""roeTTM"": 0.3639, ""roicTTM"": 0.2288, ""rotcTTM"": 0.3012, ""salesPerShare"": 15.2328, ""sgaToSale"": 0.753, ""totalDebtToEquity"": 0.5729, ""totalDebtToTotalAsset"": 0.1831, ""totalDebtToTotalCapital"": 0.3642, ""totalRatio"": 1.4698, ""period"": ""2023-01-28""}"
5,2023-02-12,113.8332290649414,2023-02-19,114.3372802734375,0.004427979533186521,U1,"[{""date"": ""20230211230300"", ""headline"": ""Are retailers finally wrangling inventory issues?"", ""summary"": ""Looking for stock market analysis and research with proves results? Zacks.com offers in-depth financial research with over 30years of proven results.""}, {""date"": ""20230213122200"", ""headline"": ""Ross Stores Inc. stock underperforms Monday when compared to competitors despite daily gains"", ""summary"": ""Shares of Ross Stores Inc. rose 1.39% to $116.78 Monday, on what proved to be an all-around great trading session for the stock market, with the S&P 500...""}, {""date"": ""20230214050100"", ""headline"": ""Top 5 4th Quarter Trades of Court Place Advisors, LLC"", ""summary"": ""Looking for stock market analysis and research with proves results? Zacks.com offers in-depth financial research with over 30years of proven results.""}, {""date"": ""20230214121005"", ""headline"": ""Why Ross Stores (ROST) Could Beat Earnings Estimates Again"", ""summary"": ""Ross Stores (ROST) has an impressive earnings surprise history and currently possesses the right combination of the two key ingredients for a likely beat in its next quarterly report.""}, {""date"": ""20230214122200"", ""headline"": ""Ross Stores Inc. stock rises Tuesday, outperforms market"", ""summary"": ""Shares of Ross Stores Inc. inched 0.02% higher to $116.80 Tuesday, on what proved to be an all-around poor trading session for the stock market, with the S&P...""}, {""date"": ""20230214160100"", ""headline"": ""Ross Stores, Inc. Announces Fourth Quarter and Fiscal 2022 Earnings Release and Conference Call"", ""summary"": ""DUBLIN, Calif., February 14, 2023--Ross Stores, Inc. (NASDAQ: ROST) plans to release its fourth quarter and fiscal 2022 earnings results on Tuesday, February 28, 2023 at approximately 4:00 p.m. Eastern time.""}, {""date"": ""20230215122200"", ""headline"": ""Ross Stores Inc. stock underperforms Wednesday when compared to competitors"", ""summary"": ""Shares of Ross Stores Inc. sank 0.14% to $116.64 Wednesday, on what proved to be an all-around great trading session for the stock market, with the S&P 500...""}, {""date"": ""20230216090002"", ""headline"": ""Want Better Returns? Don't Ignore These 2 Retail-Wholesale Stocks Set to Beat Earnings"", ""summary"": ""Why investors should use the Zacks Earnings ESP tool to help find stocks that are poised to top quarterly earnings estimates.""}, {""date"": ""20230216120005"", ""headline"": ""Ross Stores (ROST) Upgraded to Buy: What Does It Mean for the Stock?"", ""summary"": ""Ross Stores (ROST) has been upgraded to a Zacks Rank #2 (Buy), reflecting growing optimism about the company's earnings prospects. This might drive the stock higher in the near term.""}, {""date"": ""20230216122200"", ""headline"": ""Ross Stores Inc. stock outperforms market despite losses on the day"", ""summary"": ""Shares of Ross Stores Inc. slid 1.13% to $115.32 Thursday, on what proved to be an all-around rough trading session for the stock market, with the S&P 500...""}, {""date"": ""20230217010100"", ""headline"": ""Hound Partners, LLC Buys 2, Sells 3 in 4th Quarter"", ""summary"": ""Looking for stock market analysis and research with proves results? Zacks.com offers in-depth financial research with over 30years of proven results.""}, {""date"": ""20230217013100"", ""headline"": ""Analysts Offer Insights on Consumer Goods Companies: Ross Stores (ROST) and Five Below (FIVE)"", ""summary"": ""Looking for stock market analysis and research with proves results? Zacks.com offers in-depth financial research with over 30years of proven results.""}, {""date"": ""20230217030100"", ""headline"": ""Cornerstone Investment Partners, LLC Buys 1, Sells 4 in 4th Quarter"", ""summary"": ""Looking for stock market analysis and research with proves results? Zacks.com offers in-depth financial research with over 30years of proven results.""}, {""date"": ""20230217030100"", ""headline"": ""SCOPUS ASSET MANAGEMENT, L.P. Buys 2, Sells 3 in 4th Quarter"", ""summary"": ""Looking for stock market analysis and research with proves results? Zacks.com offers in-depth financial research with over 30years of proven results.""}, {""date"": ""20230217033000"", ""headline"": ""Ross Dress for Less to Re-Open its Tornado-Damaged Store in Round Rock, Texas"", ""summary"": ""Looking for stock market analysis and research with proves results? Zacks.com offers in-depth financial research with over 30years of proven results.""}, {""date"": ""20230217122100"", ""headline"": ""Ross Stores Inc. stock outperforms competitors on strong trading day"", ""summary"": ""Shares of Ross Stores Inc. inched 0.32% higher to $115.69 Friday, on what proved to be an all-around mixed trading session for the stock market, with the Dow...""}, {""date"": ""20230217211927"", ""headline"": ""Steven Cohen\u2019s Point72 Hedge Fund Backs Salesforce, Broadcom And Meta While Cutting Palo Alto And Workday Stakes"", ""summary"": """"}]",{}
6,2023-02-19,114.3372802734375,2023-02-26,110.15672302246094,-0.036563378462202034,D4,"[{""date"": ""20230220033000"", ""headline"": ""Ross Dress for Less to Open a New Store in Hudson, Florida"", ""summary"": ""Looking for stock market analysis and research with proves results? Zacks.com offers in-depth financial research with over 30years of proven results.""}, {""date"": ""20230221000000"", ""headline"": ""Ross Stores price target raised to $133 from $116 at Citi"", ""summary"": ""Looking for stock market analysis and research with proves results? Zacks.com offers in-depth financial research with over 30years of proven results.""}, {""date"": ""20230221033000"", ""headline"": ""Ross Dress for Less to Open a New Store in Surprise, Arizona"", ""summary"": ""Looking for stock market analysis and research with proves results? Zacks.com offers in-depth financial research with over 30years of proven results.""}, {""date"": ""20230221100003"", ""headline"": ""Ross Stores (ROST) Reports Next Week: Wall Street Expects Earnings Growth"", ""summary"": ""Ross Stores (ROST) possesses the right combination of the two key ingredients for a likely earnings beat in its upcoming report. Get prepared with the key expectations.""}, {""date"": ""20230221133000"", ""headline"": ""Off-Price Retailers\u2019 Earnings Need to Show Strength in the Face of Inflation"", ""summary"": ""Discounters TJX, Ross Stores, and Burlington have seen their stock prices soar in the last year, but can they grow earnings as prices keep going up?""}, {""date"": ""20230222033000"", ""headline"": ""Ross Dress for Less to Open a New Store in Tullahoma, Tennessee"", ""summary"": ""Looking for stock market analysis and research with proves results? Zacks.com offers in-depth financial research with over 30years of proven results.""}, {""date"": ""20230222062604"", ""headline"": ""Ross Stores' (NASDAQ:ROST) five-year total shareholder returns outpace the underlying earnings growth"", ""summary"": ""The simplest way to invest in stocks is to buy exchange traded funds. But the truth is, you can make significant gains...""}, {""date"": ""20230222100003"", ""headline"": ""Dollar Tree (DLTR) Earnings Expected to Grow: What to Know Ahead of Next Week's Release"", ""summary"": ""Dollar Tree (DLTR) doesn't possess the right combination of the two key ingredients for a likely earnings beat in its upcoming report. Get prepared with the key expectations.""}, {""date"": ""20230222122100"", ""headline"": ""Ross Stores Inc. stock underperforms Wednesday when compared to competitors"", ""summary"": ""Shares of Ross Stores Inc. slipped 0.22% to $112.66 Wednesday, on what proved to be an all-around poor trading session for the stock market, with the S&P 500...""}, {""date"": ""20230223033000"", ""headline"": ""Ross Dress for Less to Open a New Store in Shawnee, Kansas"", ""summary"": ""Looking for stock market analysis and research with proves results? Zacks.com offers in-depth financial research with over 30years of proven results.""}, {""date"": ""20230223063300"", ""headline"": ""Relative Strength Alert For Ross Stores"", ""summary"": ""Looking for stock market analysis and research with proves results? Zacks.com offers in-depth financial research with over 30years of proven results.""}, {""date"": ""20230223093002"", ""headline"": ""What to Expect From Sprouts Farmers (SFM) in Q4 Earnings?"", ""summary"": ""Sprouts Farmers' (SFM) fourth-quarter results are likely to reflect a focus on product innovation, targeted marketing and creating a robust omnichannel experience.""}, {""date"": ""20230223122100"", ""headline"": ""Ross Stores Inc. stock underperforms Thursday when compared to competitors"", ""summary"": ""Shares of Ross Stores Inc. shed 1.04% to $111.49 Thursday, on what proved to be an all-around favorable trading session for the stock market, with the S&P...""}, {""date"": ""20230223193912"", ""headline"": ""2 Retail Stocks to Consider Buying Before Earnings"", ""summary"": ""There is plenty of opportunity amongst the broader Zacks Retail and Wholesale sector. Here are two stocks investors may want to consider buying with earnings approaching.""}, {""date"": ""20230223200300"", ""headline"": ""Catalyst watch: Tesla event, Microsoft talks OpenAI, Rivian earnings and Chevron"", ""summary"": ""Looking for stock market analysis and research with proves results? Zacks.com offers in-depth financial research with over 30years of proven results.""}, {""date"": ""20230224033000"", ""headline"": ""Ross Dress for Less to Open a New Store in Thornton, Colorado"", ""summary"": ""Looking for stock market analysis and research with proves results? Zacks.com offers in-depth financial research with over 30years of proven results.""}, {""date"": ""20230224070300"", ""headline"": ""Earnings week ahead: Salesforce, Target, Broadcom, Lowe`s, and more"", ""summary"": ""Looking for stock market analysis and research with proves results? Zacks.com offers in-depth financial research with over 30years of proven results.""}, {""date"": ""20230224091202"", ""headline"": ""Factors to Support Ross Stores' (ROST) Earnings Beat in Q4"", ""summary"": ""Ross Stores' (ROST) Q4 results are expected to reflect gains from strong customer demand and improved traffic trends, along with the execution of its store expansion plans.""}, {""date"": ""20230224093502"", ""headline"": ""Down -7.64% in 4 Weeks, Here's Why Ross Stores (ROST) Looks Ripe for a Turnaround"", ""summary"": ""Ross Stores (ROST) is technically in oversold territory now, so the heavy selling pressure might have exhausted. This along with strong agreement among Wall Street analysts in raising earnings estimates could lead to a trend reversal for the stock.""}, {""date"": ""20230224122100"", ""headline"": ""Ross Stores Inc. stock outperforms competitors despite losses on the day"", ""summary"": ""Shares of Ross Stores Inc. sank 0.03% to $111.46 Friday, on what proved to be an all-around grim trading session for the stock market, with the S&P 500 Index...""}, {""date"": ""20230226132900"", ""headline"": ""Stocks Poised for Mixed Open"", ""summary"": ""The Conference Board on Tuesday releases its Consumer Confidence Index for February, measuring Americans' attitudes toward the economy and labor market.""}]",{}
