,Start Date,Start Price,End Date,End Price,Weekly Returns,Bin Label,News,Basics
0,2023-01-08,441.09002685546875,2023-01-15,448.3575134277344,0.01647619789564403,U2,[],"{""assetTurnoverTTM"": 0.2099, ""bookValue"": 16037.8, ""cashRatio"": 0.27408815903197925, ""currentRatio"": 0.6681, ""ebitPerShare"": 3.8624, ""eps"": 18.0562, ""ev"": 51692.9, ""fcfMargin"": 0.0372, ""fcfPerShareTTM"": 6.2611, ""grossMargin"": 0.7005, ""inventoryTurnoverTTM"": 11.2704, ""longtermDebtTotalAsset"": 0.221, ""longtermDebtTotalCapital"": 0.2627, ""longtermDebtTotalEquity"": 0.3718, ""netDebtToTotalCapital"": 0.2585, ""netDebtToTotalEquity"": 0.3659, ""netMargin"": 1.3477, ""operatingMargin"": 0.2883, ""payoutRatioTTM"": 0.0577, ""pb"": 2.8572, ""peTTM"": 10.083, ""pfcfTTM"": 61.7075, ""pretaxMargin"": 0.2155, ""psTTM"": 8.5305, ""ptbv"": 5.7229, ""quickRatio"": 0.6296, ""receivablesTurnoverTTM"": 6.1357, ""roaTTM"": 0.1776, ""roeTTM"": 0.318, ""roicTTM"": 0.2129, ""rotcTTM"": 0.0714, ""salesPerShare"": 13.3979, ""sgaToSale"": 0.2995, ""tangibleBookValue"": 8007.1, ""totalDebtToEquity"": 0.4154, ""totalDebtToTotalAsset"": 0.2469, ""totalDebtToTotalCapital"": 0.2935, ""totalRatio"": 2.4656, ""period"": ""2022-12-31""}"
1,2023-01-15,448.3575134277344,2023-01-22,439.02215576171875,-0.020821236148460986,D3,[],"{""assetTurnoverTTM"": 0.2099, ""bookValue"": 16037.8, ""cashRatio"": 0.27408815903197925, ""currentRatio"": 0.6681, ""ebitPerShare"": 3.8624, ""eps"": 18.0562, ""ev"": 51692.9, ""fcfMargin"": 0.0372, ""fcfPerShareTTM"": 6.2611, ""grossMargin"": 0.7005, ""inventoryTurnoverTTM"": 11.2704, ""longtermDebtTotalAsset"": 0.221, ""longtermDebtTotalCapital"": 0.2627, ""longtermDebtTotalEquity"": 0.3718, ""netDebtToTotalCapital"": 0.2585, ""netDebtToTotalEquity"": 0.3659, ""netMargin"": 1.3477, ""operatingMargin"": 0.2883, ""payoutRatioTTM"": 0.0577, ""pb"": 2.8572, ""peTTM"": 10.083, ""pfcfTTM"": 61.7075, ""pretaxMargin"": 0.2155, ""psTTM"": 8.5305, ""ptbv"": 5.7229, ""quickRatio"": 0.6296, ""receivablesTurnoverTTM"": 6.1357, ""roaTTM"": 0.1776, ""roeTTM"": 0.318, ""roicTTM"": 0.2129, ""rotcTTM"": 0.0714, ""salesPerShare"": 13.3979, ""sgaToSale"": 0.2995, ""tangibleBookValue"": 8007.1, ""totalDebtToEquity"": 0.4154, ""totalDebtToTotalAsset"": 0.2469, ""totalDebtToTotalCapital"": 0.2935, ""totalRatio"": 2.4656, ""period"": ""2022-12-31""}"
2,2023-01-22,439.02215576171875,2023-01-29,431.5856018066406,-0.016938903555278273,D2,"[{""date"": ""20230123212100"", ""headline"": ""Big Tech Layoffs; Signs of Trouble in the Housing Market"", ""summary"": ""John Rotonti, head of investor training and development at The Motley Fool, talks with Jurrien Timmer, director of global macro at Fidelity Investments, about what history can teach about the current market cycle and sectors that may hold opportunities for investors.  Motley Fool Stock Advisor is open to new members for just $99 a year.""}, {""date"": ""20230125232300"", ""headline"": ""Roper Technologies Inc. stock rises Thursday, still underperforms market"", ""summary"": ""Looking for stock market analysis and research with proves results? Zacks.com offers in-depth financial research with over 30years of proven results.""}, {""date"": ""20230126062200"", ""headline"": ""Roper Q4 2022 Earnings Preview"", ""summary"": ""Looking for stock market analysis and research with proves results? Zacks.com offers in-depth financial research with over 30years of proven results.""}, {""date"": ""20230126232300"", ""headline"": ""Roper Technologies Inc. stock falls Friday, underperforms market"", ""summary"": ""Looking for stock market analysis and research with proves results? Zacks.com offers in-depth financial research with over 30years of proven results.""}, {""date"": ""20230127005900"", ""headline"": ""Roper Technologies reports Q4 adjusted EPS $3.92, consensus $3.77"", ""summary"": ""Looking for stock market analysis and research with proves results? Zacks.com offers in-depth financial research with over 30years of proven results.""}, {""date"": ""20230127010000"", ""headline"": ""Roper Technologies sees FY23 adjusted EPS $15.90-$16.20, consensus $15.95"", ""summary"": ""Looking for stock market analysis and research with proves results? Zacks.com offers in-depth financial research with over 30years of proven results.""}, {""date"": ""20230127010100"", ""headline"": ""Roper Technologies sees Q1 adjusted EPS $3.80-$3.84, consensus $3.82"", ""summary"": ""Looking for stock market analysis and research with proves results? Zacks.com offers in-depth financial research with over 30years of proven results.""}, {""date"": ""20230127010400"", ""headline"": ""Roper Non-GAAP EPS of $3.92 beats by $0.15, revenue of $1.43B in-line, initiates 2023 guidance"", ""summary"": ""Looking for stock market analysis and research with proves results? Zacks.com offers in-depth financial research with over 30years of proven results.""}, {""date"": ""20230127021500"", ""headline"": ""Roper Technologies: Q4 Earnings Snapshot"", ""summary"": ""Looking for stock market analysis and research with proves results? Zacks.com offers in-depth financial research with over 30years of proven results.""}, {""date"": ""20230127065500"", ""headline"": ""Roper Technologies Announces 2022 Financial Results and Initiates 2023 Guidance"", ""summary"": ""SARASOTA, Fla., Jan. 27, 2023 (GLOBE NEWSWIRE) -- Roper Technologies, Inc. (NYSE: ROP) reported financial results for the fourth quarter and full year ended December 31, 2022. Unless otherwise noted, the results and guidance in this press release are presented on a continuing operations basis. Fourth Quarter 2022 Highlights Revenue increased 14% to $1.43 billion; organic revenue increased 7%GAAP DEPS increased 48% to $2.32; adjusted DEPS increased 17% to $3.92GAAP net earnings were $247 millionA""}, {""date"": ""20230127072106"", ""headline"": ""Roper Technologies Inc. (ROP) Q4 2022 Earnings Call Transcript"", ""summary"": ""Roper Technologies Inc. (NYSE:NYSE:ROP) Q4 2022 Results Conference Call January 27, 2023 8:00 AM ETCompany Participants Zack Moxcey - Vice President-Investor RelationsNeil Hunn - President...""}, {""date"": ""20230127081501"", ""headline"": ""Roper Technologies (ROP) Q4 Earnings and Revenues Beat Estimates"", ""summary"": ""Roper Technologies (ROP) delivered earnings and revenue surprises of 3.98% and 0.91%, respectively, for the quarter ended December 2022. Do the numbers hold clues to what lies ahead for the stock?""}, {""date"": ""20230127094122"", ""headline"": ""Roper Technologies Registers 14% Revenue Growth In Q4; Bottom-Line Beats Street View"", ""summary"": ""Roper Technologies, Inc (NYSE: ROP) reported fourth-quarter FY22 adjusted revenue growth of 14% year-over-year to $1.43 billion, which was in line with the consensus. Organic revenue grew 7% Y/Y. Sales by segments: Application Software $739.8 million (+22.2% Y/Y), Network Software $350.5 million (+8.7% Y/Y), Technology Enabled Products $340.6 million (+3.7% Y/Y). Gross margin was flattish at 70%. Adjusted EBITDA margin expanded by 110 bps to 41.4%. Adjusted EPS of $3.92 beat the consensus of $3.""}, {""date"": ""20230127111404"", ""headline"": ""Roper (ROP) Q4 Earnings & Revenues Surpass Estimates"", ""summary"": ""Roper's (ROP) Q4 earnings reflect gains from solid segmental results.""}, {""date"": ""20230128094812"", ""headline"": ""Roper Technologies Full Year 2022 Earnings: EPS Beats Expectations"", ""summary"": ""Roper Technologies ( NYSE:ROP ) Full Year 2022 Results Key Financial Results Revenue: US$5.37b (down 7.0% from FY...""}, {""date"": ""20230129021500"", ""headline"": ""New Buy Rating for Roper Technologies (ROP), the Technology Giant"", ""summary"": ""Looking for stock market analysis and research with proves results? Zacks.com offers in-depth financial research with over 30years of proven results.""}]",{}
3,2023-01-29,431.5856018066406,2023-02-05,427.8375244140625,-0.008684435664416235,D1,"[{""date"": ""20230129021500"", ""headline"": ""New Buy Rating for Roper Technologies (ROP), the Technology Giant"", ""summary"": ""Looking for stock market analysis and research with proves results? Zacks.com offers in-depth financial research with over 30years of proven results.""}, {""date"": ""20230129232300"", ""headline"": ""Roper Technologies Inc. stock underperforms Monday when compared to competitors"", ""summary"": ""Looking for stock market analysis and research with proves results? Zacks.com offers in-depth financial research with over 30years of proven results.""}, {""date"": ""20230130023800"", ""headline"": ""With Core Growth Slowing, Roper`s Valuation Case Is Harder To Make"", ""summary"": ""Looking for stock market analysis and research with proves results? Zacks.com offers in-depth financial research with over 30years of proven results.""}, {""date"": ""20230130052600"", ""headline"": ""Roper Technologies (ROP): New Buy Recommendation for This Technology Giant"", ""summary"": ""Looking for stock market analysis and research with proves results? Zacks.com offers in-depth financial research with over 30years of proven results.""}, {""date"": ""20230130103424"", ""headline"": ""Roper Technologies, Inc. (NYSE:ROP) Q4 2022 Earnings Call Transcript"", ""summary"": ""Roper Technologies, Inc. (NYSE:ROP) Q4 2022 Earnings Call Transcript January 27, 2023 Operator: Good morning. The Roper Technologies Conference Call will now begin. Today\u2019s call is being recorded. . I would now like to turn the call over to Zack Moxcey, Vice President, Investor Relations. Please go ahead. Zack Moxcey: Good morning, and thank you [\u2026]""}, {""date"": ""20230130153605"", ""headline"": ""With Core Growth Slowing, Roper's Valuation Case Is Harder To Make"", ""summary"": ""Roper reported in-line revenue and slightly weaker-than-expected segment-level profits for Q4. Read more to see my thoughts on ROP stock and my recommendation.""}, {""date"": ""20230130232200"", ""headline"": ""Roper Technologies Inc. stock rises Tuesday, still underperforms market"", ""summary"": ""Looking for stock market analysis and research with proves results? Zacks.com offers in-depth financial research with over 30years of proven results.""}, {""date"": ""20230131050100"", ""headline"": ""Top 5 4th Quarter Trades of Comprehensive Financial Consultants Institutional, Inc."", ""summary"": ""Looking for stock market analysis and research with proves results? Zacks.com offers in-depth financial research with over 30years of proven results.""}, {""date"": ""20230131232300"", ""headline"": ""Roper Technologies Inc. stock rises Wednesday, outperforms market"", ""summary"": ""Looking for stock market analysis and research with proves results? Zacks.com offers in-depth financial research with over 30years of proven results.""}, {""date"": ""20230201010500"", ""headline"": ""Akre Focus Fund Fourth Quarter 2022 Commentary"", ""summary"": ""2022 marked Akre Focus Fund\u00e2\u0080\u0099s first negative performance period measured over the course of a calendar year. Click here to read the full fund letter.calendar year.""}, {""date"": ""20230202090100"", ""headline"": ""Aderant Bolsters Strength of Executive Leadership Team"", ""summary"": ""ATLANTA, February 02, 2023--Aderant expands, hiring Doug Matthews as CPO & Andrew Hoyt as CTO, & promoting Jessica Kattman to Vice President, Global Marketing and Communications.""}, {""date"": ""20230202122100"", ""headline"": ""Roper Technologies Inc. stock underperforms Thursday when compared to competitors"", ""summary"": ""Shares of Roper Technologies Inc. dropped 0.31% to $432.55 Thursday, on what proved to be an all-around mixed trading session for the stock market, with the...""}, {""date"": ""20230203122200"", ""headline"": ""Roper Technologies Inc. stock falls Friday, still outperforms market"", ""summary"": ""Shares of Roper Technologies Inc. slipped 0.51% to $430.34 Friday, on what proved to be an all-around grim trading session for the stock market, with the S&P...""}]",{}
4,2023-02-05,427.8375244140625,2023-02-12,424.91461181640625,-0.00683182851167452,D1,"[{""date"": ""20230206122200"", ""headline"": ""Roper Technologies Inc. stock underperforms Monday when compared to competitors"", ""summary"": ""Shares of Roper Technologies Inc. slid 0.06% to $430.08 Monday, on what proved to be an all-around rough trading session for the stock market, with the S&P...""}, {""date"": ""20230207010100"", ""headline"": ""Top 5 4th Quarter Trades of Knowledge Leaders Capital, LLC"", ""summary"": ""Looking for stock market analysis and research with proves results? Zacks.com offers in-depth financial research with over 30years of proven results.""}, {""date"": ""20230207122100"", ""headline"": ""Roper Technologies Inc. stock rises Tuesday, still underperforms market"", ""summary"": ""Shares of Roper Technologies Inc. rose 1.04% to $434.55 Tuesday, on what proved to be an all-around great trading session for the stock market, with the S&P...""}, {""date"": ""20230208040100"", ""headline"": ""Aderant Announces Strategic Partnership with Apperio"", ""summary"": ""Looking for stock market analysis and research with proves results? Zacks.com offers in-depth financial research with over 30years of proven results.""}, {""date"": ""20230208122200"", ""headline"": ""Roper Technologies Inc. stock falls Wednesday, underperforms market"", ""summary"": ""Shares of Roper Technologies Inc. slid 1.53% to $427.91 Wednesday, on what proved to be an all-around grim trading session for the stock market, with the S&P...""}, {""date"": ""20230208141351"", ""headline"": ""15 Dividend Knights that Beat the Market Last 5 Years"", ""summary"": ""In this article, we discuss 15 dividend stocks that beat the market last five years. You can skip our detailed analysis of dividend investments and their performance over the years, and go directly to read 5 Dividend Knights that Beat The Market Last 5 Years. With the S&P 500 gaining 8.89% this year so far, [\u2026]""}, {""date"": ""20230208232200"", ""headline"": ""Roper Technologies Inc. stock rises Thursday, outperforms market"", ""summary"": ""Looking for stock market analysis and research with proves results? Zacks.com offers in-depth financial research with over 30years of proven results.""}, {""date"": ""20230209232200"", ""headline"": ""Roper Technologies Inc. stock underperforms Friday when compared to competitors"", ""summary"": ""Looking for stock market analysis and research with proves results? Zacks.com offers in-depth financial research with over 30years of proven results.""}, {""date"": ""20230210002619"", ""headline"": ""Dividend Growth Stock Watchlist - February 2023"", ""summary"": ""More than half of the stocks on my watchlist for this month are currently undervalued based on dividend yield theory. Click here for a detailed analysis.""}, {""date"": ""20230210133448"", ""headline"": ""AIVL: A New Fund In An Old Shell"", ""summary"": ""WisdomTree U.S. AI Enhanced Value Fund is a value ETF powered by a machine learning model. Click to find out why AIVL past data is irrelevant.""}, {""date"": ""20230210223516"", ""headline"": ""Compounders And Dividends: February 2023 Watch List Update"", ""summary"": ""Three companies have been removed from my watchlist and added to the active portfolio. I added four new companies to my watchlist. Read more here.""}, {""date"": ""20230211043000"", ""headline"": ""The Dividend Aristocrats Ranked By Quality Scores"", ""summary"": """"}, {""date"": ""20230211210100"", ""headline"": ""DIVIDEND ASSETS CAPITAL, LLC Buys 2, Sells 3 in 4th Quarter"", ""summary"": ""Looking for stock market analysis and research with proves results? Zacks.com offers in-depth financial research with over 30years of proven results.""}]",{}
5,2023-02-12,424.91461181640625,2023-02-19,425.1929931640625,0.0006551465633677367,U1,"[{""date"": ""20230211210100"", ""headline"": ""DIVIDEND ASSETS CAPITAL, LLC Buys 2, Sells 3 in 4th Quarter"", ""summary"": ""Looking for stock market analysis and research with proves results? Zacks.com offers in-depth financial research with over 30years of proven results.""}, {""date"": ""20230212213000"", ""headline"": ""Warren Buffett Watchers Should Tune In. Berkshire Is Lifting Veil on Stock Moves."", ""summary"": ""Investors will focus on whether the company bought more stock in Taiwan Semiconductor, or sold more of U.S. Bancorp.""}, {""date"": ""20230213122100"", ""headline"": ""Roper Technologies Inc. stock rises Monday, still underperforms market"", ""summary"": ""Shares of Roper Technologies Inc. inched 0.53% higher to $429.68 Monday, on what proved to be an all-around favorable trading session for the stock market,...""}, {""date"": ""20230213160333"", ""headline"": ""15 Dividend Growth Stocks with the Highest Growth Rates"", ""summary"": ""In this article, we discuss 15 dividend growth stocks with the highest growth rates. You can skip our detailed analysis of dividend growers and their performance over the years, and go directly to read 5 Dividend Growth Stocks with the Highest Growth Rates. Dividend-growing companies have histories of consistently increasing their dividend payments, which is [\u2026]""}, {""date"": ""20230214051752"", ""headline"": ""Estimating The Intrinsic Value Of Roper Technologies, Inc. (NYSE:ROP)"", ""summary"": ""In this article we are going to estimate the intrinsic value of Roper Technologies, Inc. ( NYSE:ROP ) by projecting its...""}, {""date"": ""20230214082536"", ""headline"": ""Roper Technologies Is A Good Buy At The Current Levels"", ""summary"": ""Roper's margins are expected to improve, thanks to improved supply chain conditions and operating leverage. See why I have a buy rating on ROP stock.""}, {""date"": ""20230214122100"", ""headline"": ""Roper Technologies Inc. stock outperforms competitors despite losses on the day"", ""summary"": ""Shares of Roper Technologies Inc. shed 0.68% to $426.76 Tuesday, on what proved to be an all-around dismal trading session for the stock market, with the S&P...""}, {""date"": ""20230215122100"", ""headline"": ""Roper Technologies Inc. stock falls Wednesday, underperforms market"", ""summary"": ""Shares of Roper Technologies Inc. slid 1.21% to $421.59 Wednesday, on what proved to be an all-around favorable trading session for the stock market, with...""}, {""date"": ""20230216045500"", ""headline"": ""Interesting ROP Put And Call Options For April 21st"", ""summary"": ""Looking for stock market analysis and research with proves results? Zacks.com offers in-depth financial research with over 30years of proven results.""}, {""date"": ""20230216083000"", ""headline"": ""Roper Technologies To Present At Barclays Investor Conference"", ""summary"": ""SARASOTA, Fla., Feb. 16, 2023 (GLOBE NEWSWIRE) -- Roper Technologies, Inc. (NYSE: ROP) announced that it is presenting at an investor conference sponsored by Barclays on Thursday, February 23, 2023 at 9:10 AM (Eastern Time), at the Loews Miami Beach Hotel in Miami Beach, FL. A link to the webcast presentation will be available in the \u201cInvestors\u201d section of the Company\u2019s website at www.ropertech.com. About Roper Technologies Roper Technologies is a constituent of the S&P 500 and Fortune 500. Rope""}, {""date"": ""20230216122200"", ""headline"": ""Roper Technologies Inc. stock rises Thursday, outperforms market"", ""summary"": ""Shares of Roper Technologies Inc. inched 0.33% higher to $422.97 Thursday, on what proved to be an all-around dismal trading session for the stock market,...""}, {""date"": ""20230217072300"", ""headline"": ""Tracking Akre Capital Management Portfolio - Q4 2022 Update"", ""summary"": ""Looking for stock market analysis and research with proves results? Zacks.com offers in-depth financial research with over 30years of proven results.""}, {""date"": ""20230217122100"", ""headline"": ""Roper Technologies Inc. stock rises Friday, outperforms market"", ""summary"": ""Shares of Roper Technologies Inc. rose 1.11% to $427.68 Friday, on what proved to be an all-around mixed trading session for the stock market, with the Dow...""}]",{}
6,2023-02-19,425.1929931640625,2023-02-26,425.9485778808594,0.0017770394360787645,U1,"[{""date"": ""20230220205900"", ""headline"": ""Fly Insider: Roper, Aflac among week`s notable insider trades"", ""summary"": ""Looking for stock market analysis and research with proves results? Zacks.com offers in-depth financial research with over 30years of proven results.""}, {""date"": ""20230221122100"", ""headline"": ""Roper Technologies Inc. stock outperforms competitors despite losses on the day"", ""summary"": ""Shares of Roper Technologies Inc. slid 1.05% to $423.21 Tuesday, on what proved to be an all-around poor trading session for the stock market, with the S&P...""}, {""date"": ""20230221140600"", ""headline"": ""DAT Truckload Volume Index: Volume Sets January Record"", ""summary"": ""BEAVERTON, Ore., February 21, 2023--The DAT Truckload Volume Index hit new highs for January, indicating solid seasonal demand for truckload services, said DAT Freight & Analytics, operators of the industry\u2019s largest online freight marketplace and DAT iQ data analytics service.""}, {""date"": ""20230221163000"", ""headline"": ""Registration For Roper Technologies Investor Day"", ""summary"": ""SARASOTA, Fla., Feb. 21, 2023 (GLOBE NEWSWIRE) -- Roper Technologies, Inc. (NYSE: ROP) today announced the opening of registration for its upcoming investor day, which will be held on March 21, 2023 at The Ritz-Carlton New York, NoMad. The event is scheduled to begin at 8:30 AM ET and conclude at 1:30 PM ET, including a lunch reception hosted by members of Roper Technologies\u2019 leadership team. Instructions for those who would like to attend the event in person or view the live webcast can be foun""}, {""date"": ""20230221220300"", ""headline"": ""Tracking Wallace Weitz`s Weitz Investment Management Portfolio - Q4 2022 Update"", ""summary"": ""Looking for stock market analysis and research with proves results? Zacks.com offers in-depth financial research with over 30years of proven results.""}, {""date"": ""20230221230157"", ""headline"": ""Tracking Wallace Weitz's Weitz Investment Management Portfolio - Q4 2022 Update"", ""summary"": ""Wallace Weitz's 13F portfolio value increased from $1.70B to $1.76B this quarter. Learn more about Weitz Investment Management's holdings and trades for Q4 2022.""}, {""date"": ""20230222122100"", ""headline"": ""Roper Technologies Inc. stock falls Wednesday, underperforms market"", ""summary"": ""Shares of Roper Technologies Inc. slid 0.38% to $421.60 Wednesday, on what proved to be an all-around poor trading session for the stock market, with the S&P...""}, {""date"": ""20230222230300"", ""headline"": ""Roper Technologies upgraded to Outperform from Peer Perform at Wolfe Research"", ""summary"": ""Looking for stock market analysis and research with proves results? Zacks.com offers in-depth financial research with over 30years of proven results.""}, {""date"": ""20230223033200"", ""headline"": ""Roper Technologies upgraded to Outperform at Wolfe Research"", ""summary"": ""Looking for stock market analysis and research with proves results? Zacks.com offers in-depth financial research with over 30years of proven results.""}, {""date"": ""20230223122100"", ""headline"": ""Roper Technologies Inc. stock rises Thursday, outperforms market"", ""summary"": ""Shares of Roper Technologies Inc. rallied 2.24% to $431.04 Thursday, on what proved to be an all-around favorable trading session for the stock market, with...""}, {""date"": ""20230223184458"", ""headline"": ""Wolfe Research Upgrades Roper Technologies (ROP)"", ""summary"": """"}, {""date"": ""20230224122100"", ""headline"": ""Roper Technologies Inc. stock outperforms market despite losses on the day"", ""summary"": ""Shares of Roper Technologies Inc. sank 0.60% to $428.44 Friday, on what proved to be an all-around dismal trading session for the stock market, with the S&P...""}, {""date"": ""20230225114225"", ""headline"": ""S&P 500 Dividend Aristocrats List: Sorted by Hedge Fund Popularity"", ""summary"": ""In this article, we will discuss the 15 S&P 500 dividend aristocrats popular among hedge funds. You can skip our detailed analysis of dividend stocks and their performance over the years, and go directly to read S&P 500 Dividend Aristocrats: Top 5 Among Hedge Funds. Investors are regaining confidence in the stock market as the [\u2026]""}]",{}
