,Start Date,Start Price,End Date,End Price,Weekly Returns,Bin Label,News,Basics
0,2023-01-08,169.82000732421875,2023-01-15,197.52999877929688,0.1631727138144239,U5+,[],{}
1,2023-01-15,197.52999877929688,2023-01-22,197.86000061035156,0.0016706415890954673,U1,[],{}
2,2023-01-22,197.86000061035156,2023-01-29,224.00999450683594,0.13216412521893162,U5+,"[{""date"": ""20230125073300"", ""headline"": ""The Key Debate for Microsoft and the Stock Market Is How Bad Things Are for Azure"", ""summary"": ""Many analysts see a buying opportunity after CFO Amy Hood issued a deeply disappointing short-term forecast for the cloud-computing business.""}, {""date"": ""20230125114126"", ""headline"": ""Why Datadog, MongoDB, and CrowdStrike Were Sinking Today"", ""summary"": ""If Microsoft is giving soft guidance, investors are wondering what awaits these three hypergrowth cloud stocks.""}, {""date"": ""20230125222500"", ""headline"": ""MongoDB initiated with a Neutral at Guggenheim"", ""summary"": ""Looking for stock market analysis and research with proves results? Zacks.com offers in-depth financial research with over 30years of proven results.""}, {""date"": ""20230126010000"", ""headline"": ""Pearl Health raises $75M Series B led by a16z to accelerate growth and innovation in value-based care"", ""summary"": ""Looking for stock market analysis and research with proves results? Zacks.com offers in-depth financial research with over 30years of proven results.""}, {""date"": ""20230127033500"", ""headline"": ""Street Wrap: Today`s Top 15 Upgrades, Downgrades, Initiations"", ""summary"": ""Looking for stock market analysis and research with proves results? Zacks.com offers in-depth financial research with over 30years of proven results.""}, {""date"": ""20230127094300"", ""headline"": ""Elastic: Potential Acquisition Target"", ""summary"": ""Elastic is a $5.5bn market cap enterprise search, security and observability software provider. Find out why we think ESTC stock could get acquired this year.""}, {""date"": ""20230129173540"", ""headline"": ""Veeva Systems: A Leading Provider Of Cloud-Based Solutions For The Pharmaceutical Industry"", ""summary"": ""Veeva Systems is a cloud-based software solution provider for the pharmaceutical and life sciences industries. See why VEEV stock is a Buy.""}]",{}
3,2023-01-29,224.00999450683594,2023-02-05,221.97999572753906,-0.009062090215063767,D1,"[{""date"": ""20230129173540"", ""headline"": ""Veeva Systems: A Leading Provider Of Cloud-Based Solutions For The Pharmaceutical Industry"", ""summary"": ""Veeva Systems is a cloud-based software solution provider for the pharmaceutical and life sciences industries. See why VEEV stock is a Buy.""}, {""date"": ""20230201200500"", ""headline"": ""MDB Makes Bullish Cross Above Critical Moving Average"", ""summary"": ""Looking for stock market analysis and research with proves results? Zacks.com offers in-depth financial research with over 30years of proven results.""}]","{""assetTurnoverTTM"": 0.5166, ""bookValue"": 739.5, ""cashRatio"": 0.7745114698385727, ""currentRatio"": 3.8005, ""ebitPerShare"": -1.0489, ""eps"": -0.9266, ""ev"": 15707.989, ""fcfMargin"": 0.0696, ""fcfPerShareTTM"": -0.2891, ""grossMargin"": 0.7534, ""longtermDebtTotalAsset"": 0.4403, ""longtermDebtTotalCapital"": 0.5911, ""longtermDebtTotalEquity"": 1.5414, ""netDebtToTotalCapital"": 0.3802, ""netDebtToTotalEquity"": 0.9916, ""netMargin"": -0.1782, ""operatingMargin"": -0.2018, ""pb"": 20.2497, ""pfcfTTM"": 437.9845, ""pretaxMargin"": -0.1702, ""psTTM"": 11.6625, ""ptbv"": 20.5668, ""quickRatio"": 3.7475, ""receivablesTurnoverTTM"": 5.3433, ""roaTTM"": -0.139, ""roeTTM"": -0.4997, ""roicTTM"": -0.1836, ""rotcTTM"": -0.1842, ""salesPerShare"": 5.1986, ""sgaToSale"": 0.2469, ""tangibleBookValue"": 728.1, ""totalDebtToEquity"": 1.608, ""totalDebtToTotalAsset"": 0.4593, ""totalDebtToTotalCapital"": 0.6166, ""totalRatio"": 1.3999, ""period"": ""2023-01-31""}"
4,2023-02-05,221.97999572753906,2023-02-12,210.6999969482422,-0.05081538425265164,D5+,"[{""date"": ""20230206002900"", ""headline"": ""MongoDB price target raised to $255 from $220 at KeyBanc"", ""summary"": ""Looking for stock market analysis and research with proves results? Zacks.com offers in-depth financial research with over 30years of proven results.""}, {""date"": ""20230207224100"", ""headline"": ""MongoDB Larger Than S&P 500 Component FleetCor Technologies"", ""summary"": ""Looking for stock market analysis and research with proves results? Zacks.com offers in-depth financial research with over 30years of proven results.""}, {""date"": ""20230208090000"", ""headline"": ""MongoDB Atlas for Government Achieves FedRAMP\u00ae Moderate Authorization"", ""summary"": ""MongoDB, Inc. (NASDAQ: MDB), today announced that it has achieved the formal FedRAMP\u00ae Moderate Authorized designation for MongoDB Atlas for Government. MongoDB Atlas for Government provides the software tools and services necessary for U.S. government organizations to quickly and easily build and deploy secure, highly-scalable, distributed applications in the cloud. In addition, an independent auditor has attested that MongoDB Atlas for Government aligns with Criminal Justice Information Service""}, {""date"": ""20230209063900"", ""headline"": ""March 31st Options Now Available For MongoDB (MDB)"", ""summary"": ""Looking for stock market analysis and research with proves results? Zacks.com offers in-depth financial research with over 30years of proven results.""}, {""date"": ""20230209070000"", ""headline"": ""Top 5 4th Quarter Trades of AnglePoint Asset Management Ltd"", ""summary"": ""Looking for stock market analysis and research with proves results? Zacks.com offers in-depth financial research with over 30years of proven results.""}, {""date"": ""20230211030300"", ""headline"": ""The Monsters Get Mushy"", ""summary"": ""Looking for stock market analysis and research with proves results? Zacks.com offers in-depth financial research with over 30years of proven results.""}]","{""assetTurnoverTTM"": 0.5166, ""bookValue"": 739.5, ""cashRatio"": 0.7745114698385727, ""currentRatio"": 3.8005, ""ebitPerShare"": -1.0489, ""eps"": -0.9266, ""ev"": 15707.989, ""fcfMargin"": 0.0696, ""fcfPerShareTTM"": -0.2891, ""grossMargin"": 0.7534, ""longtermDebtTotalAsset"": 0.4403, ""longtermDebtTotalCapital"": 0.5911, ""longtermDebtTotalEquity"": 1.5414, ""netDebtToTotalCapital"": 0.3802, ""netDebtToTotalEquity"": 0.9916, ""netMargin"": -0.1782, ""operatingMargin"": -0.2018, ""pb"": 20.2497, ""pfcfTTM"": 437.9845, ""pretaxMargin"": -0.1702, ""psTTM"": 11.6625, ""ptbv"": 20.5668, ""quickRatio"": 3.7475, ""receivablesTurnoverTTM"": 5.3433, ""roaTTM"": -0.139, ""roeTTM"": -0.4997, ""roicTTM"": -0.1836, ""rotcTTM"": -0.1842, ""salesPerShare"": 5.1986, ""sgaToSale"": 0.2469, ""tangibleBookValue"": 728.1, ""totalDebtToEquity"": 1.608, ""totalDebtToTotalAsset"": 0.4593, ""totalDebtToTotalCapital"": 0.6166, ""totalRatio"": 1.3999, ""period"": ""2023-01-31""}"
5,2023-02-12,210.6999969482422,2023-02-19,213.1300048828125,0.011533023112322294,U2,"[{""date"": ""20230213235000"", ""headline"": ""MongoDB: High Flyer Worth Waiting On"", ""summary"": ""Looking for stock market analysis and research with proves results? Zacks.com offers in-depth financial research with over 30years of proven results.""}, {""date"": ""20230215001700"", ""headline"": ""MongoDB price target raised to $264 from $240 at Barclays"", ""summary"": ""Looking for stock market analysis and research with proves results? Zacks.com offers in-depth financial research with over 30years of proven results.""}, {""date"": ""20230215005400"", ""headline"": ""MongoDB price target raised to $220 from $170 at Mizuho"", ""summary"": ""Looking for stock market analysis and research with proves results? Zacks.com offers in-depth financial research with over 30years of proven results.""}, {""date"": ""20230215150647"", ""headline"": ""MongoDB: Logical Buy Preference For Investors Seeking Near-Term Capital Gain"", ""summary"": ""MongoDB provides general purpose database platform worldwide. See why MDB stock is a logical buy preference now for investors seeking near-term capital gain.""}, {""date"": ""20230215173600"", ""headline"": ""MongoDB, Inc. Announces Date of Fourth Quarter and Full Year Fiscal 2023 Earnings Call"", ""summary"": ""MongoDB, Inc. (NASDAQ: MDB) today announced it will report its fourth quarter and full year fiscal year 2023 financial results for the three months ended January 31, 2023, after the U.S. financial markets close on Wednesday, March 8, 2023.""}, {""date"": ""20230216010100"", ""headline"": ""SQN Investors LP Cuts Portfolio Down to Size in 4th Quarter"", ""summary"": ""Looking for stock market analysis and research with proves results? Zacks.com offers in-depth financial research with over 30years of proven results.""}, {""date"": ""20230216222500"", ""headline"": ""Analyst Love Proves Little Help for MongoDB"", ""summary"": ""Looking for stock market analysis and research with proves results? Zacks.com offers in-depth financial research with over 30years of proven results.""}, {""date"": ""20230216225700"", ""headline"": ""MongoDB initiated with an Outperform at Bernstein"", ""summary"": ""Looking for stock market analysis and research with proves results? Zacks.com offers in-depth financial research with over 30years of proven results.""}, {""date"": ""20230217033300"", ""headline"": ""MongoDB slips even as Bernstein starts coverage, calls it `best of breed`"", ""summary"": ""Looking for stock market analysis and research with proves results? Zacks.com offers in-depth financial research with over 30years of proven results.""}, {""date"": ""20230217183533"", ""headline"": ""Bernstein Initiates Coverage of Mongodb (MDB) with Outperform Recommendation"", ""summary"": """"}]","{""assetTurnoverTTM"": 0.5166, ""bookValue"": 739.5, ""cashRatio"": 0.7745114698385727, ""currentRatio"": 3.8005, ""ebitPerShare"": -1.0489, ""eps"": -0.9266, ""ev"": 15707.989, ""fcfMargin"": 0.0696, ""fcfPerShareTTM"": -0.2891, ""grossMargin"": 0.7534, ""longtermDebtTotalAsset"": 0.4403, ""longtermDebtTotalCapital"": 0.5911, ""longtermDebtTotalEquity"": 1.5414, ""netDebtToTotalCapital"": 0.3802, ""netDebtToTotalEquity"": 0.9916, ""netMargin"": -0.1782, ""operatingMargin"": -0.2018, ""pb"": 20.2497, ""pfcfTTM"": 437.9845, ""pretaxMargin"": -0.1702, ""psTTM"": 11.6625, ""ptbv"": 20.5668, ""quickRatio"": 3.7475, ""receivablesTurnoverTTM"": 5.3433, ""roaTTM"": -0.139, ""roeTTM"": -0.4997, ""roicTTM"": -0.1836, ""rotcTTM"": -0.1842, ""salesPerShare"": 5.1986, ""sgaToSale"": 0.2469, ""tangibleBookValue"": 728.1, ""totalDebtToEquity"": 1.608, ""totalDebtToTotalAsset"": 0.4593, ""totalDebtToTotalCapital"": 0.6166, ""totalRatio"": 1.3999, ""period"": ""2023-01-31""}"
6,2023-02-19,213.1300048828125,2023-02-26,205.89999389648438,-0.033923008589538894,D4,"[{""date"": ""20230221063524"", ""headline"": ""Confluent: The Data Streaming Leader"", ""summary"": ""Confluent, Inc. operates a data streaming platform in the United States and internationally. Click here to read my analysis of CFLT stock.""}, {""date"": ""20230223030000"", ""headline"": ""Transcend Therapeutics, a mental health-focused biotechnology company, announces Series A funding round of $40 million led by Alpha Wave Global and Integrated Investment Partners"", ""summary"": ""Looking for stock market analysis and research with proves results? Zacks.com offers in-depth financial research with over 30years of proven results.""}, {""date"": ""20230223033100"", ""headline"": ""MongoDB price target lowered to $240 from $256 at Stifel"", ""summary"": ""Looking for stock market analysis and research with proves results? Zacks.com offers in-depth financial research with over 30years of proven results.""}, {""date"": ""20230225084106"", ""headline"": ""Is Now An Opportune Moment To Examine MongoDB, Inc. (NASDAQ:MDB)?"", ""summary"": ""Today we're going to take a look at the well-established MongoDB, Inc. ( NASDAQ:MDB ). The company's stock led the...""}, {""date"": ""20230225171000"", ""headline"": ""Baron Technology Fund Q4 2022 Quarterly Letter"", ""summary"": ""Baron Technology Fund was down 5.75% in Q4 2022 underperforming the MSCI ACWI Information Technology Index. Click here to read the full fund letter.""}]",{}
7,2023-02-26,205.89999389648438,2023-03-05,219.05999755859375,0.06391454129292273,U5+,"[{""date"": ""20230227125848"", ""headline"": ""Start Putting Together Your Shopping List For Beaten-Down Tech Stocks"", ""summary"": ""Put together a stock shopping list. You have time to understand the stocks you are investing in.""}, {""date"": ""20230302055800"", ""headline"": ""Interesting MDB Put And Call Options For April 14th"", ""summary"": ""Looking for stock market analysis and research with proves results? Zacks.com offers in-depth financial research with over 30years of proven results.""}, {""date"": ""20230302160500"", ""headline"": ""MongoDB, Inc. to Present at the Morgan Stanley Technology, Media & Telecom Conference"", ""summary"": ""MongoDB, Inc. (NASDAQ: MDB) today announced that its President and Chief Executive Officer, Dev Ittycheria, and its Chief Operating Officer and Chief Financial Officer, Michael Gordon, will present at the Morgan Stanley Technology, Media & Telecom Conference in San Francisco, CA.""}, {""date"": ""20230302212100"", ""headline"": ""Notable Friday Option Activity: MDB, AI, XPOF"", ""summary"": ""Looking for stock market analysis and research with proves results? Zacks.com offers in-depth financial research with over 30years of proven results.""}, {""date"": ""20230303070500"", ""headline"": ""Earnings week ahead: Docusign, CrowdStrike, Campbell Soup and more"", ""summary"": ""Looking for stock market analysis and research with proves results? Zacks.com offers in-depth financial research with over 30years of proven results.""}, {""date"": ""20230303152454"", ""headline"": ""Why Snowflake, Palantir, and MongoDB Rallied Today"", ""summary"": ""Interest rates backed off near-term highs and Costco management said inflation was abating, leading to a bounce in growth stocks.""}, {""date"": ""20230305183000"", ""headline"": ""Stocks Poised for Slightly Lower Open"", ""summary"": ""The Bureau of Labor Statistics will release the January Job Openings and Labor Turnover Survey on Wednesday, and the February jobs report on Friday.""}]",{}
