,Start Date,Start Price,End Date,End Price,Weekly Returns,Bin Label,News,Basics
31,2023-08-13,487.7253112792969,2023-08-20,482.9688415527344,-0.009752353664168711,D1,"[{""date"": ""20230812230050"", ""headline"": ""Constellation Software: Deploying Capital At Good ROIC"", ""summary"": ""Constellation Software acquires, manages, and builds vertical market software businesses. Read why I assign a strong buy rating to CSU:CA stock.""}, {""date"": ""20230814053100"", ""headline"": ""Roper Technologies Stock (NYSE:ROP): The Valuation is Just Too High"", ""summary"": ""Looking for stock market analysis and research with proves results? Zacks.com offers in-depth financial research with over 30years of proven results.""}, {""date"": ""20230814083600"", ""headline"": ""Here's How Much $100 Invested In Roper Techs 20 Years Ago Would Be Worth Today"", ""summary"": ""Looking for stock market analysis and research with proves results? Zacks.com offers in-depth financial research with over 30years of proven results.""}, {""date"": ""20230816070300"", ""headline"": ""Peering Into Roper Techs's Recent Short Interest"", ""summary"": ""Looking for stock market analysis and research with proves results? Zacks.com offers in-depth financial research with over 30years of proven results.""}, {""date"": ""20230817194759"", ""headline"": ""Tracking Akre Capital Management Portfolio - Q2 2023 Update"", ""summary"": ""The Akre Focus Mutual Fund has outperformed the S&P 500 Index with annualized returns of 14.54%. Click here for a detailed analysis.""}, {""date"": ""20230818062401"", ""headline"": ""DAT Truckload Volume Index : July freight volumes and rates chilled by seasonality"", ""summary"": ""Truckload freight volumes fell last month and national benchmark spot rates for dry van and refrigerated loads retreated from their gains in June, reported DAT Freight & Analytics, which operates...""}, {""date"": ""20230818082400"", ""headline"": ""Roper's DAT Freight & Analytics: July Freight Volumes & Rates Chilled By Seasonality"", ""summary"": ""Looking for stock market analysis and research with proves results? Zacks.com offers in-depth financial research with over 30years of proven results.""}, {""date"": ""20230818102300"", ""headline"": ""DAT Truckload Volume Index: July freight volumes and rates chilled by seasonality"", ""summary"": ""BEAVERTON, Ore., August 18, 2023--Truckload freight volumes fell last month and national benchmark spot rates for dry van and refrigerated (\""reefer\"") loads retreated from their gains in June, reported DAT Freight & Analytics, which operates the industry\u2019s largest online freight marketplace and DAT iQ data analytics service.""}]",{}
32,2023-08-20,482.9688415527344,2023-08-27,493.3892822265625,0.021575803193279786,U3,"[{""date"": ""20230821110000"", ""headline"": ""Aderant Unveils Latest Innovations in Expert Billing to Accelerate Law Firm Digital Transformation"", ""summary"": ""ATLANTA, August 21, 2023--Today, Aderant releases version 8.2 SP3 of its practice management software, Expert, used by the majority of the largest law firms around the world.""}, {""date"": ""20230823030300"", ""headline"": ""Durable Capital Partners LP Reduces Stake in Warby Parker Inc"", ""summary"": ""Looking for stock market analysis and research with proves results? Zacks.com offers in-depth financial research with over 30years of proven results.""}, {""date"": ""20230824090500"", ""headline"": ""75% of truck drivers say their job is mentally and physically stressful"", ""summary"": ""BEAVERTON, Ore., August 24, 2023--Truck drivers find their work fulfilling; however, nearly 75% state the job is physically and emotionally stressful according to a new survey from DAT Freight & Analytics. Moreover, few drivers are able to take care of their well-being and seek support when needed.""}, {""date"": ""20230824111517"", ""headline"": ""Roper Technologies: Great Software Conglomerate Making Another Move"", ""summary"": ""Roper Technologies is active in software & engineered product business, holding leading positions in niche segments. Click here to read my analysis of ROP stock.""}]",{}
33,2023-08-27,493.3892822265625,2023-09-03,498.12579345703125,0.009599947548706078,U1,"[{""date"": ""20230829110000"", ""headline"": ""Roper Technologies to present at Goldman Sachs technology conference"", ""summary"": ""SARASOTA, Fla., Aug. 29, 2023 (GLOBE NEWSWIRE) -- Roper Technologies, Inc. (Nasdaq: ROP) announced that it is presenting at the Goldman Sachs Communacopia + Technology Conference on Wednesday, September 6, 2023 at 8:10 AM (Pacific Time), at the Palace in San Francisco, CA. A link to the webcast presentation will be available in the \u201cInvestors\u201d section of the Company\u2019s website at www.ropertech.com. About Roper Technologies Roper Technologies is a constituent of the S&P 500 and Fortune 1000. Roper""}, {""date"": ""20230831223200"", ""headline"": ""$100 Invested In Roper Techs 10 Years Ago Would Be Worth This Much Today"", ""summary"": ""Looking for stock market analysis and research with proves results? Zacks.com offers in-depth financial research with over 30years of proven results.""}, {""date"": ""20230901113139"", ""headline"": ""Amdocs (DOX) Up 0.3% Since Last Earnings Report: Can It Continue?"", ""summary"": ""Amdocs (DOX) reported earnings 30 days ago. What's next for the stock? We take a look at earnings estimates for some clues.""}]",{}
34,2023-09-03,498.12579345703125,2023-09-10,490.1185607910156,-0.016074720022917988,D2,"[{""date"": ""20230904120005"", ""headline"": ""Roper Technologies (ROP) Is Up 0.96% in One Week: What You Should Know"", ""summary"": ""Does Roper Technologies (ROP) have what it takes to be a top stock pick for momentum investors? Let's find out.""}, {""date"": ""20230904121000"", ""headline"": ""Roper (ROP) Up 16% in 6 Months: Will the Uptrend Continue?"", ""summary"": ""Roper (ROP) stands to benefit from strength in its Application Software segment, acquired assets and improving supply chains.""}, {""date"": ""20230905175500"", ""headline"": ""Analytics, AI and fighting fraud at DATCON23"", ""summary"": ""BEAVERTON, Ore., September 05, 2023--A deep dive into freight market analytics and reducing the risk of fraudulent activity will be central themes at DATCON23, the annual flagship event and user conference for DAT Freight & Analytics customers.""}, {""date"": ""20230906072200"", ""headline"": ""Zacks Industry Outlook Highlights Roper Technologies, Check Point Software, Vertiv and Wix.com"", ""summary"": ""Roper Technologies, Check Point Software, Vertiv and Wix.com are part of the Zacks Industry Outlook article.""}, {""date"": ""20230907042200"", ""headline"": ""Peering Into Roper Techs's Recent Short Interest"", ""summary"": ""Looking for stock market analysis and research with proves results? Zacks.com offers in-depth financial research with over 30years of proven results.""}, {""date"": ""20230910085722"", ""headline"": ""What Does Roper Technologies, Inc.'s (NASDAQ:ROP) Share Price Indicate?"", ""summary"": ""Roper Technologies, Inc. ( NASDAQ:ROP ) received a lot of attention from a substantial price movement on the NASDAQGS...""}]",{}
35,2023-09-10,490.1185607910156,2023-09-17,494.4063720703125,0.008748518465361954,U1,"[{""date"": ""20230910085722"", ""headline"": ""What Does Roper Technologies, Inc.'s (NASDAQ:ROP) Share Price Indicate?"", ""summary"": ""Roper Technologies, Inc. ( NASDAQ:ROP ) received a lot of attention from a substantial price movement on the NASDAQGS...""}, {""date"": ""20230912002029"", ""headline"": ""Dividend Growth Stock Watchlist - September 2023"", ""summary"": ""About half of the 20 stocks on my dividend growth watchlist for September 2023 are undervalued based on dividend yield theory. Read an analysis here.""}, {""date"": ""20230915085800"", ""headline"": ""Modine Manufacturing Can Continue Its Outperformance"", ""summary"": ""Looking for stock market analysis and research with proves results? Zacks.com offers in-depth financial research with over 30years of proven results.""}]",{}
36,2023-09-17,494.4063720703125,2023-09-24,493.5687255859375,-0.0016942469427879692,D1,"[{""date"": ""20230918090000"", ""headline"": ""Misty Sobanski Named Recipient of the 2023 Women in Supply Chain Award"", ""summary"": ""Helps Global CPG Producer Save Millions in Freight Bills and Supply Chain Services Misty Sobanski Named Recipient of the 2023 Women in Supply Chain Award Misty Sobanski Named Recipient of the 2023 Women in Supply Chain Award ATLANTA, Sept. 18, 2023 (GLOBE NEWSWIRE) -- IntelliTrans, a leader in global multimodal solutions for optimizing supply chain operations for bulk and break-bulk industries, announces that Misty Sobanski, Engagement Manager at IntelliTrans, is one of the winners of this year\u2019""}, {""date"": ""20230918102600"", ""headline"": ""DAT Truckload Volume Index: Freight volumes bounced back in August"", ""summary"": ""BEAVERTON, Ore., September 18, 2023--Truckload freight volumes increased in August as shippers positioned freight ahead of the fourth quarter, said DAT Freight & Analytics, operators of the DAT One freight marketplace and DAT iQ data analytics service.""}, {""date"": ""20230921083400"", ""headline"": ""Agree To Buy Roper Technologies At $400, Earn 2.5% Using Options"", ""summary"": ""Looking for stock market analysis and research with proves results? Zacks.com offers in-depth financial research with over 30years of proven results.""}, {""date"": ""20230921090400"", ""headline"": ""DAT Announces Industry\u2019s First AI-powered Identity-Verification Solution to Combat Fraud"", ""summary"": ""BEAVERTON, Ore., September 21, 2023--DAT Freight & Analytics today introduced the first purpose-built, AI-powered identity fraud detection and prevention platform through a partnership with Verosint, to help prevent the unauthorized use of customer login credentials and combat the growing threat of identity theft in trucking and logistics.""}]",{}
37,2023-09-24,493.5687255859375,2023-10-01,482.90899658203125,-0.021597253738578348,D3,"[{""date"": ""20230925045200"", ""headline"": ""Peering Into Roper Techs's Recent Short Interest"", ""summary"": ""Looking for stock market analysis and research with proves results? Zacks.com offers in-depth financial research with over 30years of proven results.""}, {""date"": ""20230927085600"", ""headline"": ""Roper declares $0.6825 dividend"", ""summary"": ""Looking for stock market analysis and research with proves results? Zacks.com offers in-depth financial research with over 30years of proven results.""}, {""date"": ""20230927093000"", ""headline"": ""Roper Technologies announces dividend"", ""summary"": ""Looking for stock market analysis and research with proves results? Zacks.com offers in-depth financial research with over 30years of proven results.""}, {""date"": ""20230929073300"", ""headline"": ""$100 Invested In This Stock 20 Years Ago Would Be Worth $2,100 Today"", ""summary"": ""Looking for stock market analysis and research with proves results? Zacks.com offers in-depth financial research with over 30years of proven results.""}, {""date"": ""20231001022143"", ""headline"": ""Dividend Champion, Contender, And Challenger Highlights: Week Of October 1"", ""summary"": ""A weekly summary of dividend activity for Dividend Champions, Contenders, and Challengers. Click here to read the update for the week of October 1.""}]","{""assetTurnoverTTM"": 0.2185, ""bookValue"": 17038.7, ""cashRatio"": 0.10648131688413269, ""currentRatio"": 0.5349, ""ebitPerShare"": 4.1459, ""eps"": 3.2268, ""ev"": 58214.07, ""fcfMargin"": 0.3887, ""fcfPerShareTTM"": 13.1068, ""grossMargin"": 0.7012, ""inventoryTurnoverTTM"": 16.2049, ""longtermDebtTotalAsset"": 0.2263, ""longtermDebtTotalCapital"": 0.2667, ""longtermDebtTotalEquity"": 0.3744, ""netDebtToTotalCapital"": 0.2751, ""netDebtToTotalEquity"": 0.3861, ""netMargin"": 0.2221, ""operatingMargin"": 0.2853, ""payoutRatioTTM"": 0.097, ""pb"": 3.0305, ""peTTM"": 17.6615, ""pfcfTTM"": 36.8797, ""pretaxMargin"": 0.2831, ""psTTM"": 8.6128, ""ptbv"": 5.9384, ""quickRatio"": 0.4913, ""receivablesTurnoverTTM"": 7.5525, ""roaTTM"": 0.1065, ""roeTTM"": 0.1768, ""roicTTM"": 0.1257, ""rotcTTM"": 0.0729, ""salesPerShare"": 14.5297, ""sgaToSale"": 0.2988, ""tangibleBookValue"": 8695.1, ""totalDebtToEquity"": 0.4037, ""totalDebtToTotalAsset"": 0.244, ""totalDebtToTotalCapital"": 0.2876, ""totalRatio"": 2.5282, ""period"": ""2023-09-30""}"
38,2023-10-01,482.90899658203125,2023-10-08,494.1204833984375,0.02321656232490943,U3,"[{""date"": ""20231001022143"", ""headline"": ""Dividend Champion, Contender, And Challenger Highlights: Week Of October 1"", ""summary"": ""A weekly summary of dividend activity for Dividend Champions, Contenders, and Challengers. Click here to read the update for the week of October 1.""}, {""date"": ""20231003230443"", ""headline"": ""U.S. Wide-Moat Stocks On Sale - The October 2023 Heat Map"", ""summary"": ""Discover the 3-step process of selecting wide-moat stocks, with a focus on attractively valued candidates. See a heat map of investment candidates here.""}, {""date"": ""20231003233900"", ""headline"": ""Roper Technologies Moves Up In Market Cap Rank, Passing Pioneer Natural Resources"", ""summary"": ""Looking for stock market analysis and research with proves results? Zacks.com offers in-depth financial research with over 30years of proven results.""}, {""date"": ""20231004083000"", ""headline"": ""Roper Technologies schedules third quarter 2023 financial results conference call"", ""summary"": ""SARASOTA, Fla., Oct. 04, 2023 (GLOBE NEWSWIRE) -- Roper Technologies, Inc. (Nasdaq: ROP) announced that its financial results for the third quarter of 2023, ended September 30, 2023, will be released before the market opens on Wednesday, October 25, 2023. A conference call to discuss these results has been scheduled for 8:00 AM ET on Wednesday, October 25, 2023. The call can be accessed via webcast or by dialing +1 844-750-4898 (US/Canada) or +1 412-317-5294, using confirmation number 10182514.""}, {""date"": ""20231004230400"", ""headline"": ""Durable Capital Partners LP Reduces Stake in Duolingo Inc"", ""summary"": ""Looking for stock market analysis and research with proves results? Zacks.com offers in-depth financial research with over 30years of proven results.""}, {""date"": ""20231005022700"", ""headline"": ""Roper Technologies (ROP) Gets a Buy from Barclays"", ""summary"": ""Looking for stock market analysis and research with proves results? Zacks.com offers in-depth financial research with over 30years of proven results.""}, {""date"": ""20231005111936"", ""headline"": ""10 Best October Dividend Stocks To Buy"", ""summary"": ""In this article, we discuss 10 best October dividend stocks to buy now. You can skip our detailed analysis of dividend stocks and the dividend capture strategy, and go directly to read 5 Best October Dividend Stocks To Buy. Dividend payments around the world have been growing significantly because investors are increasingly interested in income-generating [\u2026]""}, {""date"": ""20231006105600"", ""headline"": ""Here's Why Roper (ROP) Deserves a Place in Your Portfolio"", ""summary"": ""Roper (ROP) is thriving on the back of strength in the Deltek, Vertafore and Aderant businesses and acquired assets. The company's commitment to reward its shareholders is encouraging.""}, {""date"": ""20231008095344"", ""headline"": ""Investing in Roper Technologies (NASDAQ:ROP) five years ago would have delivered you a 82% gain"", ""summary"": ""Stock pickers are generally looking for stocks that will outperform the broader market. And in our experience, buying...""}]","{""assetTurnoverTTM"": 0.2185, ""bookValue"": 17038.7, ""cashRatio"": 0.10648131688413269, ""currentRatio"": 0.5349, ""ebitPerShare"": 4.1459, ""eps"": 3.2268, ""ev"": 58214.07, ""fcfMargin"": 0.3887, ""fcfPerShareTTM"": 13.1068, ""grossMargin"": 0.7012, ""inventoryTurnoverTTM"": 16.2049, ""longtermDebtTotalAsset"": 0.2263, ""longtermDebtTotalCapital"": 0.2667, ""longtermDebtTotalEquity"": 0.3744, ""netDebtToTotalCapital"": 0.2751, ""netDebtToTotalEquity"": 0.3861, ""netMargin"": 0.2221, ""operatingMargin"": 0.2853, ""payoutRatioTTM"": 0.097, ""pb"": 3.0305, ""peTTM"": 17.6615, ""pfcfTTM"": 36.8797, ""pretaxMargin"": 0.2831, ""psTTM"": 8.6128, ""ptbv"": 5.9384, ""quickRatio"": 0.4913, ""receivablesTurnoverTTM"": 7.5525, ""roaTTM"": 0.1065, ""roeTTM"": 0.1768, ""roicTTM"": 0.1257, ""rotcTTM"": 0.0729, ""salesPerShare"": 14.5297, ""sgaToSale"": 0.2988, ""tangibleBookValue"": 8695.1, ""totalDebtToEquity"": 0.4037, ""totalDebtToTotalAsset"": 0.244, ""totalDebtToTotalCapital"": 0.2876, ""totalRatio"": 2.5282, ""period"": ""2023-09-30""}"
39,2023-10-08,494.1204833984375,2023-10-15,497.12615966796875,0.0060828813427424855,U1,"[{""date"": ""20231008095344"", ""headline"": ""Investing in Roper Technologies (NASDAQ:ROP) five years ago would have delivered you a 82% gain"", ""summary"": ""Stock pickers are generally looking for stocks that will outperform the broader market. And in our experience, buying...""}, {""date"": ""20231009032200"", ""headline"": ""Analysts Are Neutral on These Industrial Goods Stocks: MSC Industrial (MSM), Roper Technologies (ROP)"", ""summary"": ""Looking for stock market analysis and research with proves results? Zacks.com offers in-depth financial research with over 30years of proven results.""}, {""date"": ""20231010012721"", ""headline"": ""Dividend Growth Stock Watchlist - October 2023"", ""summary"": ""More than half of the stocks on my watchlist are undervalued based on dividend yield theory. Click here for a detailed analysis.""}, {""date"": ""20231011050400"", ""headline"": ""Durable Capital Partners LP Reduces Stake in Duolingo Inc"", ""summary"": ""Looking for stock market analysis and research with proves results? Zacks.com offers in-depth financial research with over 30years of proven results.""}, {""date"": ""20231011053300"", ""headline"": ""How Is The Market Feeling About Roper Techs?"", ""summary"": ""Looking for stock market analysis and research with proves results? Zacks.com offers in-depth financial research with over 30years of proven results.""}, {""date"": ""20231011092800"", ""headline"": ""DAT\u2019s New Risk Assessment Engine Enables Unprecedented Industry Trust and Transparency"", ""summary"": ""HOUSTON, October 11, 2023--DAT Freight & Analytics today introduced an innovative new risk assessment engine that uses artificial intelligence and DAT\u2019s extensive proprietary data to give customers an unprecedented level of insight into a potential partner\u2019s risk profile and performance.""}, {""date"": ""20231011100000"", ""headline"": ""LIBRA Successfully Launches Innovative Technology from iPipeline\u00ae to Aggregate, Accelerate, and Ensure Compliance of Data"", ""summary"": ""iPipeline\u00ae announces that LIBRA Insurance Partners, the largest independently owned life insurance marketing organization (IMO) in the United States, successfully implemented its Agency Integrator product recently to support the LIBRA Institutional Insurance Platform (LIIP).""}, {""date"": ""20231011222300"", ""headline"": ""Akre Capital's Akre Focus Fund 3rd-Quarter Commentary: Higher for Longer"", ""summary"": ""Looking for stock market analysis and research with proves results? Zacks.com offers in-depth financial research with over 30years of proven results.""}, {""date"": ""20231013132735"", ""headline"": ""KNG: Enhancing Dividend Aristocrat Yields With Covered Calls"", ""summary"": ""First Trust Cboe Vest S&P 500 Dividend Aristocrats Target Income ETF implements a buy-write strategy with dividend aristocrats. Read more about KNG here.""}, {""date"": ""20231014071803"", ""headline"": ""Dividend Champion, Contender, And Challenger Highlights: Week Of October 15"", ""summary"": ""Stay updated on dividend activity with our weekly summary for Dividend Champions, Contenders, and Challengers.""}]","{""assetTurnoverTTM"": 0.2185, ""bookValue"": 17038.7, ""cashRatio"": 0.10648131688413269, ""currentRatio"": 0.5349, ""ebitPerShare"": 4.1459, ""eps"": 3.2268, ""ev"": 58214.07, ""fcfMargin"": 0.3887, ""fcfPerShareTTM"": 13.1068, ""grossMargin"": 0.7012, ""inventoryTurnoverTTM"": 16.2049, ""longtermDebtTotalAsset"": 0.2263, ""longtermDebtTotalCapital"": 0.2667, ""longtermDebtTotalEquity"": 0.3744, ""netDebtToTotalCapital"": 0.2751, ""netDebtToTotalEquity"": 0.3861, ""netMargin"": 0.2221, ""operatingMargin"": 0.2853, ""payoutRatioTTM"": 0.097, ""pb"": 3.0305, ""peTTM"": 17.6615, ""pfcfTTM"": 36.8797, ""pretaxMargin"": 0.2831, ""psTTM"": 8.6128, ""ptbv"": 5.9384, ""quickRatio"": 0.4913, ""receivablesTurnoverTTM"": 7.5525, ""roaTTM"": 0.1065, ""roeTTM"": 0.1768, ""roicTTM"": 0.1257, ""rotcTTM"": 0.0729, ""salesPerShare"": 14.5297, ""sgaToSale"": 0.2988, ""tangibleBookValue"": 8695.1, ""totalDebtToEquity"": 0.4037, ""totalDebtToTotalAsset"": 0.244, ""totalDebtToTotalCapital"": 0.2876, ""totalRatio"": 2.5282, ""period"": ""2023-09-30""}"
40,2023-10-15,497.12615966796875,2023-10-22,481.4287109375,-0.03157638845832034,D4,"[{""date"": ""20231017083800"", ""headline"": ""IntelliTrans Ken Sherman Presents Upcoming Transportation Market Trends Webinar"", ""summary"": ""Free Live Webinar Discusses Shipper Issues in Today\u2019s Market and How Technology Can Address These ChallengesATLANTA, Oct. 17, 2023 (GLOBE NEWSWIRE) -- IntelliTrans, a leader in global multimodal solutions for optimizing supply chain operations for bulk and break-bulk industries, announces that Ken Sherman, Industry Expert and Former President of IntelliTrans, will be presenting \u201cHow to win in a tough transportation market using technology\u201d in a free webinar on October 25, 2023, at 2:00 PM. Ken w""}, {""date"": ""20231017100900"", ""headline"": ""Can Application Software Strength Lift Roper (ROP) Q3 Earnings?"", ""summary"": ""Roper's (ROP) Q3 earnings results are expected to reflect solid performance of the Application Software unit due to growth in the Deltek, Vertafore and Aderant businesses.""}, {""date"": ""20231018100125"", ""headline"": ""Roper Technologies (ROP) Reports Next Week: Wall Street Expects Earnings Growth"", ""summary"": ""Roper Technologies (ROP) possesses the right combination of the two key ingredients for a likely earnings beat in its upcoming report. Get prepared with the key expectations.""}, {""date"": ""20231018150900"", ""headline"": ""DAT Truckload Volume Index: Freight volumes cooled in September"", ""summary"": ""BEAVERTON, Ore., October 18, 2023--Truckload freight volumes cooled in September, compounding an already difficult quarter for truckload carriers and freight brokers, said DAT Freight & Analytics, which operates the industry\u2019s largest online freight marketplace and DAT iQ data analytics service.""}, {""date"": ""20231019053500"", ""headline"": ""$1000 Invested In This Stock 20 Years Ago Would Be Worth $22,000 Today"", ""summary"": ""Looking for stock market analysis and research with proves results? Zacks.com offers in-depth financial research with over 30years of proven results.""}, {""date"": ""20231019073000"", ""headline"": ""Akre Focus Fund Q3 2023 Commentary"", ""summary"": ""Akre Focus Fund's Q2 2023 performance for the Institutional share class was -4.10% vs. S&P 500 Total Return at -3.27%. Click here to read the full fund letter.""}, {""date"": ""20231019220400"", ""headline"": ""Analyst Expectations for Roper Techs's Future"", ""summary"": ""Looking for stock market analysis and research with proves results? Zacks.com offers in-depth financial research with over 30years of proven results.""}, {""date"": ""20231020225250"", ""headline"": ""Truist Securities Reiterates Roper Technologies (ROP) Buy Recommendation"", ""summary"": """"}]",{}
