,Start Date,Start Price,End Date,End Price,Weekly Returns,Bin Label,News,Basics
39,2023-10-08,353.6199951171875,2023-10-15,350.67999267578125,-0.008314016407448777,D1,"[{""date"": ""20231008213200"", ""headline"": ""Here's How Much You Would Have Made Owning MongoDB Stock In The Last 5 Years"", ""summary"": ""Looking for stock market analysis and research with proves results? Zacks.com offers in-depth financial research with over 30years of proven results.""}, {""date"": ""20231009040300"", ""headline"": ""How Is The Market Feeling About MongoDB?"", ""summary"": ""Looking for stock market analysis and research with proves results? Zacks.com offers in-depth financial research with over 30years of proven results.""}, {""date"": ""20231010013500"", ""headline"": ""MongoDB initiated with a Sector Perform at Scotiabank"", ""summary"": ""Looking for stock market analysis and research with proves results? Zacks.com offers in-depth financial research with over 30years of proven results.""}, {""date"": ""20231010015000"", ""headline"": ""Scotiabank starts MongoDB at Sector Perform, sees minimal AI tailwind in 2024"", ""summary"": ""Looking for stock market analysis and research with proves results? Zacks.com offers in-depth financial research with over 30years of proven results.""}, {""date"": ""20231010053200"", ""headline"": ""Cantor Fitzgerald software analysts to hold an analyst/industry conference call"", ""summary"": ""Looking for stock market analysis and research with proves results? Zacks.com offers in-depth financial research with over 30years of proven results.""}, {""date"": ""20231010060400"", ""headline"": ""Benzinga's Top Ratings Upgrades, Downgrades For October 10, 2023"", ""summary"": ""Looking for stock market analysis and research with proves results? Zacks.com offers in-depth financial research with over 30years of proven results.""}, {""date"": ""20231010093248"", ""headline"": ""Rivian upgraded, Qorvo downgraded: Wall Street's top analyst calls"", ""summary"": ""Rivian upgraded, Qorvo downgraded: Wall Street's top analyst calls""}, {""date"": ""20231010184647"", ""headline"": ""7 Innovator Stocks Primed for Exceptional Growth"", ""summary"": ""Artificial intelligence. New pharmaceutical drugs. Cutting-edge communication software. With so many disruptive technologies and innovations emerging every year, thousands of investor opportunities abound. These all present ways to capitalize upon potential future leaders in various niches. In 2022, investors saw the S&P 500 growth index fall by 30%. While many growth companies suffered massive losses to that bear market, the advent of AI reignited several small and large-cap companies\u2019 growth p""}, {""date"": ""20231010232900"", ""headline"": ""MongoDB director Merriman sells 2,000 class A shares"", ""summary"": ""Looking for stock market analysis and research with proves results? Zacks.com offers in-depth financial research with over 30years of proven results.""}, {""date"": ""20231010235700"", ""headline"": ""MongoDB says Dwight Merriman sells 2K shares"", ""summary"": ""Looking for stock market analysis and research with proves results? Zacks.com offers in-depth financial research with over 30years of proven results.""}, {""date"": ""20231011015705"", ""headline"": ""Scotiabank Initiates Coverage of MongoDB Inc - (MDB) with Sector Perform Recommendation"", ""summary"": """"}, {""date"": ""20231011080300"", ""headline"": ""Check Out What Whales Are Doing With MDB"", ""summary"": ""Looking for stock market analysis and research with proves results? Zacks.com offers in-depth financial research with over 30years of proven results.""}, {""date"": ""20231012010900"", ""headline"": ""MongoDB initiated with a Buy at BofA"", ""summary"": ""Looking for stock market analysis and research with proves results? Zacks.com offers in-depth financial research with over 30years of proven results.""}, {""date"": ""20231012014200"", ""headline"": ""Analysts Offer Insights on Technology Companies: MongoDB (MDB) and Adobe (ADBE)"", ""summary"": ""Looking for stock market analysis and research with proves results? Zacks.com offers in-depth financial research with over 30years of proven results.""}, {""date"": ""20231012025500"", ""headline"": ""MongoDB gets Buy at BofA, while Snowflake initiated with Neutral"", ""summary"": ""Looking for stock market analysis and research with proves results? Zacks.com offers in-depth financial research with over 30years of proven results.""}, {""date"": ""20231012040000"", ""headline"": ""Doug Band, Co-Founder and former President of Teneo, joins AlleyCorp as a Venture Partner"", ""summary"": ""Looking for stock market analysis and research with proves results? Zacks.com offers in-depth financial research with over 30years of proven results.""}, {""date"": ""20231012045000"", ""headline"": ""Target upgraded, Beyond Meat downgraded: Wall Street's top analyst calls"", ""summary"": ""Looking for stock market analysis and research with proves results? Zacks.com offers in-depth financial research with over 30years of proven results.""}, {""date"": ""20231012060500"", ""headline"": ""Benzinga's Top Ratings Upgrades, Downgrades For October 12, 2023"", ""summary"": ""Looking for stock market analysis and research with proves results? Zacks.com offers in-depth financial research with over 30years of proven results.""}, {""date"": ""20231012065000"", ""headline"": ""Interesting MDB Put And Call Options For December 1st"", ""summary"": ""Looking for stock market analysis and research with proves results? Zacks.com offers in-depth financial research with over 30years of proven results.""}, {""date"": ""20231012213300"", ""headline"": ""Here's How Much $100 Invested In MongoDB 5 Years Ago Would Be Worth Today"", ""summary"": ""Looking for stock market analysis and research with proves results? Zacks.com offers in-depth financial research with over 30years of proven results.""}, {""date"": ""20231013034511"", ""headline"": ""B of A Securities Initiates Coverage of MongoDB Inc - (MDB) with Buy Recommendation"", ""summary"": """"}]",{}
40,2023-10-15,350.67999267578125,2023-10-22,346.2799987792969,-0.01254703430016424,D2,"[{""date"": ""20231016080300"", ""headline"": ""Looking At MongoDB's Recent Unusual Options Activity"", ""summary"": ""Looking for stock market analysis and research with proves results? Zacks.com offers in-depth financial research with over 30years of proven results.""}, {""date"": ""20231016100042"", ""headline"": ""Q2 Earnings Highlights: Commvault Systems (NASDAQ:CVLT) Vs The Rest Of The Data Storage Stocks"", ""summary"": ""As data storage stocks\u2019 Q2 earnings season wraps, let's dig into this quarter's best and worst performers, including Commvault Systems (NASDAQ:CVLT) and its peers.""}, {""date"": ""20231016170310"", ""headline"": ""14 Best SaaS Stocks To Buy Now"", ""summary"": ""In this piece, we will take a look at the 14 best SaaS stocks to buy now. If you want to skip our overview of the SaaS industry, then take a look at the 5 Best SaaS Stocks To Buy Now. The dot com era of the 1990s focused on the consumer side of the [\u2026]""}, {""date"": ""20231016203528"", ""headline"": ""MongoDB: Strong Business Performance Should Continue"", ""summary"": ""MondoDB is a provider of an open-source NoSQL database and generates revenue through a subscription-based model. See why MDB stock is rated a buy.""}, {""date"": ""20231017074500"", ""headline"": ""Cloud Stocks: MongoDB Focuses On Verticalized Offerings"", ""summary"": ""Looking for stock market analysis and research with proves results? Zacks.com offers in-depth financial research with over 30years of proven results.""}, {""date"": ""20231018093419"", ""headline"": ""Winners And Losers Of Q2: Couchbase (NASDAQ:BASE) Vs The Rest Of The Data Storage Stocks"", ""summary"": ""The end of an earnings season can be a great time to assess how companies are handling the current business environment and discover new stocks. Let\u2019s take a look at how Couchbase (NASDAQ:BASE) and the rest of the data storage stocks fared in Q2.""}, {""date"": ""20231018113442"", ""headline"": ""MongoDB: Hold Off On Buying, Despite Fantastic Results"", ""summary"": ""MongoDB's high valuation and macroeconomic risks make it difficult to justify buying the stock at its current price. Read more to see our analysis of MDB.""}, {""date"": ""20231020105114"", ""headline"": ""Reflecting On Data Storage Stocks\u2019 Q2 Earnings: DigitalOcean (NYSE:DOCN)"", ""summary"": ""Let's dig into the relative performance of DigitalOcean (NYSE:DOCN) and its peers as we unravel the now-completed Q2 data storage earnings season.""}]",{}
41,2023-10-22,346.2799987792969,2023-10-29,335.30999755859375,-0.03167956930626803,D4,"[{""date"": ""20231023025300"", ""headline"": ""Walgreens To Rally Around 42%? Here Are 10 Top Analyst Forecasts For Monday"", ""summary"": ""Looking for stock market analysis and research with proves results? Zacks.com offers in-depth financial research with over 30years of proven results.""}, {""date"": ""20231023050200"", ""headline"": ""18 Analysts Have This to Say About MongoDB"", ""summary"": ""Looking for stock market analysis and research with proves results? Zacks.com offers in-depth financial research with over 30years of proven results.""}, {""date"": ""20231023074200"", ""headline"": ""AI will be a multi-year phenomenon, transforming all aspects of business"", ""summary"": ""Looking for stock market analysis and research with proves results? Zacks.com offers in-depth financial research with over 30years of proven results.""}, {""date"": ""20231023090826"", ""headline"": ""Keybanc Maintains MongoDB Inc - (MDB) Overweight Recommendation"", ""summary"": """"}, {""date"": ""20231025033300"", ""headline"": ""MongoDB price target lowered to $440 from $495 at KeyBanc"", ""summary"": ""Looking for stock market analysis and research with proves results? Zacks.com offers in-depth financial research with over 30years of proven results.""}, {""date"": ""20231025081800"", ""headline"": ""How Is The Market Feeling About MongoDB?"", ""summary"": ""Looking for stock market analysis and research with proves results? Zacks.com offers in-depth financial research with over 30years of proven results.""}]",{}
42,2023-10-29,335.30999755859375,2023-11-05,343.1099853515625,0.023262019772034126,U3,"[{""date"": ""20231030081500"", ""headline"": ""MongoDB put volume heavy and directionally bearish"", ""summary"": ""Looking for stock market analysis and research with proves results? Zacks.com offers in-depth financial research with over 30years of proven results.""}, {""date"": ""20231031010100"", ""headline"": ""Analysts Offer Insights on Technology Companies: Caci International (CACI) and MongoDB (MDB)"", ""summary"": ""Looking for stock market analysis and research with proves results? Zacks.com offers in-depth financial research with over 30years of proven results.""}, {""date"": ""20231031212200"", ""headline"": ""3 Top Tech Stocks with High Upside Potential"", ""summary"": ""Looking for stock market analysis and research with proves results? Zacks.com offers in-depth financial research with over 30years of proven results.""}]","{""assetTurnoverTTM"": 0.6037, ""bookValue"": 967.54, ""cashRatio"": 0.9757171191450335, ""currentRatio"": 4.7401, ""ebitPerShare"": -0.6319, ""eps"": -0.4094, ""ev"": 25506.353, ""fcfMargin"": 0.0839, ""fcfPerShareTTM"": 1.2323, ""grossMargin"": 0.7527, ""longtermDebtTotalAsset"": 0.4241, ""longtermDebtTotalCapital"": 0.5301, ""longtermDebtTotalEquity"": 1.1808, ""netDebtToTotalCapital"": 0.3294, ""netDebtToTotalEquity"": 0.7337, ""netMargin"": -0.0677, ""operatingMargin"": -0.1044, ""pb"": 25.6284, ""pfcfTTM"": 216.3481, ""pretaxMargin"": -0.0593, ""psTTM"": 15.6313, ""ptbv"": 25.8186, ""quickRatio"": 4.6646, ""receivablesTurnoverTTM"": 6.3078, ""roaTTM"": -0.0706, ""roeTTM"": -0.2192, ""roicTTM"": -0.0912, ""rotcTTM"": -0.1158, ""salesPerShare"": 6.05, ""sgaToSale"": 0.2473, ""tangibleBookValue"": 960.413, ""totalDebtToEquity"": 1.2274, ""totalDebtToTotalAsset"": 0.4408, ""totalDebtToTotalCapital"": 0.551, ""totalRatio"": 1.5604, ""period"": ""2023-10-31""}"
43,2023-11-05,343.1099853515625,2023-11-12,376.8900146484375,0.09845248095086134,U5+,"[{""date"": ""20231106000600"", ""headline"": ""MongoDB, Amazon Web Services collaborate to optimize Amazon CodeWhisperer"", ""summary"": ""Looking for stock market analysis and research with proves results? Zacks.com offers in-depth financial research with over 30years of proven results.""}, {""date"": ""20231106060000"", ""headline"": ""MongoDB and AWS Collaborate to Optimize Amazon CodeWhisperer Suggestions for Developers Building Applications on MongoDB"", ""summary"": ""MongoDB, Inc. (NASDAQ: MDB) and Amazon Web Services, Inc. (AWS), an Amazon.com (NASDAQ: AMZN) company, today announced the two companies are collaborating to optimize Amazon CodeWhisperer to provide enhanced suggestions for application development and modernization on MongoDB's industry-leading developer data platform that millions of developers and tens of thousands of customers rely on every day for business-critical applications. Trained on billions of lines of Amazon and publicly available c""}, {""date"": ""20231106071751"", ""headline"": ""Those who invested in MongoDB (NASDAQ:MDB) five years ago are up 391%"", ""summary"": ""Long term investing can be life changing when you buy and hold the truly great businesses. While not every stock...""}, {""date"": ""20231106200000"", ""headline"": ""Dow Jones edges higher as stocks head to 7 day winning streak led by tech stocks"", ""summary"": ""Looking for stock market analysis and research with proves results? Zacks.com offers in-depth financial research with over 30years of proven results.""}, {""date"": ""20231106225300"", ""headline"": ""S&P 500, Nasdaq record longest winning streaks in two years"", ""summary"": ""Looking for stock market analysis and research with proves results? Zacks.com offers in-depth financial research with over 30years of proven results.""}, {""date"": ""20231106234800"", ""headline"": ""S&P 500 scores longest win steak in two years"", ""summary"": ""U.S. stocks end higher Tuesday, with the S&P 500 and Nasdaq Composite securing their longest winning streaks in two years.""}, {""date"": ""20231107001000"", ""headline"": ""Uber, Datadog stocks gain, Air Products shares lead S&P 500 losers and other stocks on the move"", ""summary"": ""Uber, Tripadvisor, Planet Fitness, Air Products shares were active.""}, {""date"": ""20231107022300"", ""headline"": ""Datadog rallies on strong Q3 earnings, outlook"", ""summary"": ""Looking for stock market analysis and research with proves results? Zacks.com offers in-depth financial research with over 30years of proven results.""}, {""date"": ""20231107023000"", ""headline"": ""S&P 500 Futures Drop in Premarket Trading; Datadog, Snowflake Lead"", ""summary"": ""With U.S. stock markets set to open in two hours, (DDOG) was up 23.8% in pre-market trading, and (SNOW) was up 7.6%. (CELH), (MDB), and (IFF) were all...""}, {""date"": ""20231107023500"", ""headline"": ""Datadog Stock Is Having Its Best Day Ever. What\u2019s Exciting Investors."", ""summary"": ""For the fourth quarter, Datadog expects revenue of between\u00a0$564 million\u00a0and\u00a0$568 million, beating analysts\u2019 estimates of $544.9 million.""}, {""date"": ""20231107024500"", ""headline"": ""Dow futures threaten to snap 6-day winning streak"", ""summary"": ""Looking for stock market analysis and research with proves results? Zacks.com offers in-depth financial research with over 30years of proven results.""}, {""date"": ""20231107024700"", ""headline"": ""SNOW, MDB and DOCN are among pre market gainers"", ""summary"": ""Looking for stock market analysis and research with proves results? Zacks.com offers in-depth financial research with over 30years of proven results.""}, {""date"": ""20231107030000"", ""headline"": ""Snowflake, MongoDB shares rally sharply after Datadog earnings"", ""summary"": ""Shares of Snowflake Inc. MongoDB Inc. and Elastic NV were all rallying sharply in Tuesday\u2019s premarket trading after Datadog Inc.\u2019s upbeat earnings report...""}, {""date"": ""20231107034000"", ""headline"": ""Unusually active option classes on open November 7th"", ""summary"": ""Looking for stock market analysis and research with proves results? Zacks.com offers in-depth financial research with over 30years of proven results.""}, {""date"": ""20231107034500"", ""headline"": ""Dow Jones ticks lower after 6-day winning streak"", ""summary"": ""Looking for stock market analysis and research with proves results? Zacks.com offers in-depth financial research with over 30years of proven results.""}, {""date"": ""20231107042000"", ""headline"": ""Why Zscaler Inc's Stock Skyrocketed 12% in a Quarter"", ""summary"": ""Looking for stock market analysis and research with proves results? Zacks.com offers in-depth financial research with over 30years of proven results.""}, {""date"": ""20231107042600"", ""headline"": ""Dow Jones struggles for direction after 6-day winning streak"", ""summary"": ""Looking for stock market analysis and research with proves results? Zacks.com offers in-depth financial research with over 30years of proven results.""}, {""date"": ""20231107042800"", ""headline"": ""Stock Market Pauses After Bond Short Squeeze Triggered Epic Rally, Apple Recovers"", ""summary"": ""Looking for stock market analysis and research with proves results? Zacks.com offers in-depth financial research with over 30years of proven results.""}, {""date"": ""20231107045700"", ""headline"": ""Datadog, Tripadvisor, Myriad Genetics, Planet Fitness And Other Big Stocks Moving Higher On Tuesday"", ""summary"": ""Looking for stock market analysis and research with proves results? Zacks.com offers in-depth financial research with over 30years of proven results.""}, {""date"": ""20231107051400"", ""headline"": ""Dow Jones pushes higher as stocks attempt to push winning streak to 7 days"", ""summary"": ""Looking for stock market analysis and research with proves results? Zacks.com offers in-depth financial research with over 30years of proven results.""}, {""date"": ""20231107070400"", ""headline"": ""Dow Jones edges higher as stocks attempt to push winning streak to 7 days"", ""summary"": ""Looking for stock market analysis and research with proves results? Zacks.com offers in-depth financial research with over 30years of proven results.""}, {""date"": ""20231107071500"", ""headline"": ""Why Sanmina Shares Are Trading Lower By Around 15%? Here Are Other Stocks Moving In Tuesday's Mid-Day Session"", ""summary"": ""Looking for stock market analysis and research with proves results? Zacks.com offers in-depth financial research with over 30years of proven results.""}, {""date"": ""20231107100132"", ""headline"": ""US STOCKS-S&P 500, Dow subdued as rate cut optimism wanes"", ""summary"": ""The S&P 500 and Dow Jones were subdued on Tuesday as optimism over potential rate cuts from the Federal Reserve next year waned, with investors on tenterhooks ahead of more commentary from central bank officials.""}, {""date"": ""20231107100138"", ""headline"": ""S&P 500, Dow subdued as rate cut optimism wanes"", ""summary"": ""The S&P 500 and Dow Jones were subdued on Tuesday as optimism over potential rate cuts from the Federal Reserve next year waned, with investors on tenterhooks ahead of more commentary from central bank officials.""}, {""date"": ""20231107131454"", ""headline"": ""Why Snowflake, MongoDB, and Other Cloud Stocks Rallied on Tuesday"", ""summary"": ""After an impressive run-up to start the year, the major market indexes have been taking a breather as investors have stepped back to assess the ongoing economic recovery.  The Federal Reserve Bank has paused its campaign of interest rate hikes in the face of evidence that inflation is finally easing.  Investors have also been monitoring a pullback in cloud spending and are still holding out hope for a so-called \""soft landing,\"" with the economy narrowly avoiding a recession.""}, {""date"": ""20231107210200"", ""headline"": ""What 19 Analyst Ratings Have To Say About MongoDB"", ""summary"": ""Looking for stock market analysis and research with proves results? Zacks.com offers in-depth financial research with over 30years of proven results.""}, {""date"": ""20231107223200"", ""headline"": ""What You Missed On Wall Street On Wednesday"", ""summary"": ""Looking for stock market analysis and research with proves results? Zacks.com offers in-depth financial research with over 30years of proven results.""}, {""date"": ""20231108004100"", ""headline"": ""Bank of America Says This \u2018Buy\u2019 Signal Could Trigger an 11% Upswing in S&P 500 Next Year \u2014 Here Are 2 Stocks the Banking Giant Likes Right Now"", ""summary"": ""Looking for stock market analysis and research with proves results? Zacks.com offers in-depth financial research with over 30years of proven results.""}, {""date"": ""20231108021600"", ""headline"": ""Bull of the Day: Datadog"", ""summary"": ""Looking for stock market analysis and research with proves results? Zacks.com offers in-depth financial research with over 30years of proven results.""}, {""date"": ""20231108022900"", ""headline"": ""MongoDB upgraded to Overweight from Equalweight at Capital One"", ""summary"": ""Looking for stock market analysis and research with proves results? Zacks.com offers in-depth financial research with over 30years of proven results.""}, {""date"": ""20231108024400"", ""headline"": ""Snowflake, MongoDB, Confluent get upgrades at CapitalOne after Datadog results"", ""summary"": ""Looking for stock market analysis and research with proves results? Zacks.com offers in-depth financial research with over 30years of proven results.""}, {""date"": ""20231108025400"", ""headline"": ""Capital One upgrades trio of data management names after  Datadog earnings"", ""summary"": ""Looking for stock market analysis and research with proves results? Zacks.com offers in-depth financial research with over 30years of proven results.""}, {""date"": ""20231108033800"", ""headline"": ""If You Invested $1000 In This Stock 5 Years Ago, You Would Have $5,400 Today"", ""summary"": ""Looking for stock market analysis and research with proves results? Zacks.com offers in-depth financial research with over 30years of proven results.""}, {""date"": ""20231108040000"", ""headline"": ""Snowflake upgraded, Lucid downgraded: Wall Street's top analyst calls"", ""summary"": ""Looking for stock market analysis and research with proves results? Zacks.com offers in-depth financial research with over 30years of proven results.""}, {""date"": ""20231108075800"", ""headline"": ""What You Missed On Wall Street This Morning"", ""summary"": ""Looking for stock market analysis and research with proves results? Zacks.com offers in-depth financial research with over 30years of proven results.""}, {""date"": ""20231108155941"", ""headline"": ""Capital One Upgrades MongoDB Inc - (MDB)"", ""summary"": """"}, {""date"": ""20231108205300"", ""headline"": ""Looking At MongoDB's Recent Unusual Options Activity"", ""summary"": ""Looking for stock market analysis and research with proves results? Zacks.com offers in-depth financial research with over 30years of proven results.""}, {""date"": ""20231109040000"", ""headline"": ""Bernstein tech analysts to hold an analyst/industry conference call"", ""summary"": ""Looking for stock market analysis and research with proves results? Zacks.com offers in-depth financial research with over 30years of proven results.""}, {""date"": ""20231109160500"", ""headline"": ""MongoDB, Inc. Announces Date of Third Quarter Fiscal 2024 Earnings Call"", ""summary"": ""MongoDB, Inc. (NASDAQ: MDB) today announced it will report its third quarter fiscal year 2024 financial results for the three months ended October 31, 2023, after the U.S. financial markets close on Tuesday, December 5, 2023.""}, {""date"": ""20231109202900"", ""headline"": ""Buy/Sell: Wall Street's top 10 stock calls this week"", ""summary"": ""Looking for stock market analysis and research with proves results? Zacks.com offers in-depth financial research with over 30years of proven results.""}, {""date"": ""20231109213000"", ""headline"": ""How Is The Market Feeling About MongoDB?"", ""summary"": ""Looking for stock market analysis and research with proves results? Zacks.com offers in-depth financial research with over 30years of proven results.""}, {""date"": ""20231111224000"", ""headline"": ""Wall Street's Top 10 Stock Calls This Week - Sunday, Nov. 12"", ""summary"": ""Looking for stock market analysis and research with proves results? Zacks.com offers in-depth financial research with over 30years of proven results.""}]","{""assetTurnoverTTM"": 0.6037, ""bookValue"": 967.54, ""cashRatio"": 0.9757171191450335, ""currentRatio"": 4.7401, ""ebitPerShare"": -0.6319, ""eps"": -0.4094, ""ev"": 25506.353, ""fcfMargin"": 0.0839, ""fcfPerShareTTM"": 1.2323, ""grossMargin"": 0.7527, ""longtermDebtTotalAsset"": 0.4241, ""longtermDebtTotalCapital"": 0.5301, ""longtermDebtTotalEquity"": 1.1808, ""netDebtToTotalCapital"": 0.3294, ""netDebtToTotalEquity"": 0.7337, ""netMargin"": -0.0677, ""operatingMargin"": -0.1044, ""pb"": 25.6284, ""pfcfTTM"": 216.3481, ""pretaxMargin"": -0.0593, ""psTTM"": 15.6313, ""ptbv"": 25.8186, ""quickRatio"": 4.6646, ""receivablesTurnoverTTM"": 6.3078, ""roaTTM"": -0.0706, ""roeTTM"": -0.2192, ""roicTTM"": -0.0912, ""rotcTTM"": -0.1158, ""salesPerShare"": 6.05, ""sgaToSale"": 0.2473, ""tangibleBookValue"": 960.413, ""totalDebtToEquity"": 1.2274, ""totalDebtToTotalAsset"": 0.4408, ""totalDebtToTotalCapital"": 0.551, ""totalRatio"": 1.5604, ""period"": ""2023-10-31""}"
