,Start Date,Start Price,End Date,End Price,Weekly Returns,Bin Label,News,Basics
12,2023-04-02,438.12738037109375,2023-04-09,433.84442138671875,-0.009775602202143463,D1,"[{""date"": ""20230401201149"", ""headline"": ""Dividend Champion, Contender, And Challenger Highlights: Week Of April 2"", ""summary"": ""Weekly summary of dividend activity for Dividend Champions, Contenders, Challengers. Read more to see the companies with upcoming ex-dividend dates.""}, {""date"": ""20230402070000"", ""headline"": ""SVB Collapse Complicates Banks\u2019 Efforts to Unload More Than $25 Billion of Junk Debt"", ""summary"": ""Recent turmoil in the banking industry has made the already-difficult task of selling off tens of billions of risky buyout debt even harder for Wall Street firms.  Bank of America  ,  Barclays  PLC,  Morgan Stanley  and others together currently hold $25 billion to $30 billion of \u201chung debt\u201d on their balance sheets, according to leveraged-finance analytics firm 9fin.  The unsold debt is tied to leveraged buyouts that banks agreed to finance before worsening credit conditions last year sapped investor appetite for the paper.""}, {""date"": ""20230403065439"", ""headline"": ""Is Now An Opportune Moment To Examine Roper Technologies, Inc. (NYSE:ROP)?"", ""summary"": ""Today we're going to take a look at the well-established Roper Technologies, Inc. ( NYSE:ROP ). The company's stock saw...""}, {""date"": ""20230403075201"", ""headline"": ""10 Best April Dividend Stocks To Buy"", ""summary"": ""In this article, we discuss 10 best April dividend stocks to buy. You can skip our detailed analysis of dividend stocks and their performance in the past, and go directly to read 5 Best April Dividend Stocks To Buy. Dividend stocks remain on investors\u2019 radar in 2023 amid rising inflation and recession fears. According to [\u2026]""}, {""date"": ""20230403132100"", ""headline"": ""Roper Technologies Inc. stock rises Monday, still underperforms market"", ""summary"": ""Shares of Roper Technologies Inc. inched 0.02% higher to $440.79 Monday, on what proved to be an all-around great trading session for the stock market, with...""}, {""date"": ""20230403220215"", ""headline"": ""Dividend Growth Stock Watchlist - April 2023"", ""summary"": ""There are 19 stocks on my dividend growth watchlist for April 2023. Click here to learn more about these stocks.""}, {""date"": ""20230404083000"", ""headline"": ""Roper Technologies Schedules First Quarter 2023\u00a0Financial Results Conference Call"", ""summary"": ""SARASOTA, Fla., April 04, 2023 (GLOBE NEWSWIRE) -- Roper Technologies, Inc. (NYSE: ROP) announced that its financial results for the first quarter of 2023, ended March 31, 2023, will be released before the market opens on Thursday, April 27, 2023. A conference call to discuss these results has been scheduled for 8:00 AM ET on Thursday, April 27, 2023. The call can be accessed via webcast or by dialing +1 844-750-4898 (US/Canada) or +1 412-317-5294, using confirmation number 10177373. Webcast inf""}, {""date"": ""20230404132100"", ""headline"": ""Roper Technologies Inc. stock falls Tuesday, underperforms market"", ""summary"": ""Shares of Roper Technologies Inc. slumped 0.86% to $437.01 Tuesday, on what proved to be an all-around grim trading session for the stock market, with the...""}, {""date"": ""20230404230919"", ""headline"": ""U.S. Wide-Moat Stocks On Sale - The April 2023 Heat Map"", ""summary"": ""We believe that the most widely used valuation multiples are terribly flawed. Click here for a complete analysis.""}, {""date"": ""20230405132100"", ""headline"": ""Roper Technologies Inc. stock outperforms market on strong trading day"", ""summary"": ""Shares of Roper Technologies Inc. inched 0.25% higher to $437.40 Wednesday, on what proved to be an all-around mixed trading session for the stock market,...""}, {""date"": ""20230406075700"", ""headline"": ""Nicholas Ward`s Dividend Growth Portfolio: Special Fixed Income Edition"", ""summary"": ""Looking for stock market analysis and research with proves results? Zacks.com offers in-depth financial research with over 30years of proven results.""}, {""date"": ""20230406132100"", ""headline"": ""Roper Technologies Inc. stock falls Thursday, underperforms market"", ""summary"": ""Shares of Roper Technologies Inc. shed 0.39% to $435.70 Thursday, on what proved to be an all-around positive trading session for the stock market, with the...""}, {""date"": ""20230406205614"", ""headline"": ""Nicholas Ward's Dividend Growth Portfolio: Special Fixed Income Edition"", ""summary"": ""My passive income stream grew by 22.63% in February and by 46.87% in March. Read more as I review my February and March results in this piece.""}]","{""assetTurnoverTTM"": 0.2142, ""bookValue"": 16332.7, ""cashRatio"": 0.42574043381134247, ""currentRatio"": 0.8043, ""ebitPerShare"": 3.7477, ""eps"": 2.6458, ""ev"": 52302.648, ""fcfMargin"": 0.3021, ""fcfPerShareTTM"": 6.0755, ""grossMargin"": 0.6931, ""inventoryTurnoverTTM"": 10.6232, ""longtermDebtTotalAsset"": 0.2198, ""longtermDebtTotalCapital"": 0.2594, ""longtermDebtTotalEquity"": 0.3652, ""netDebtToTotalCapital"": 0.2384, ""netDebtToTotalEquity"": 0.3357, ""netMargin"": 0.1926, ""operatingMargin"": 0.2728, ""payoutRatioTTM"": 0.0959, ""pb"": 2.8667, ""peTTM"": 16.6781, ""pfcfTTM"": 64.4997, ""pretaxMargin"": 0.245, ""psTTM"": 8.4184, ""ptbv"": 5.5337, ""quickRatio"": 0.7628, ""receivablesTurnoverTTM"": 6.9726, ""roaTTM"": 0.1081, ""roeTTM"": 0.1873, ""roicTTM"": 0.1285, ""rotcTTM"": 0.0718, ""salesPerShare"": 13.7355, ""sgaToSale"": 0.3069, ""tangibleBookValue"": 8461, ""totalDebtToEquity"": 0.408, ""totalDebtToTotalAsset"": 0.2456, ""totalDebtToTotalCapital"": 0.2898, ""totalRatio"": 2.512, ""period"": ""2023-03-31""}"
13,2023-04-09,433.84442138671875,2023-04-16,438.0364990234375,0.009662628882767255,U1,"[{""date"": ""20230410132100"", ""headline"": ""Roper Technologies Inc. stock rises Monday, outperforms market"", ""summary"": ""Shares of Roper Technologies Inc. inched 0.12% higher to $436.24 Monday, on what proved to be an all-around favorable trading session for the stock market,...""}, {""date"": ""20230411132100"", ""headline"": ""Roper Technologies Inc. stock outperforms market on strong trading day"", ""summary"": ""Shares of Roper Technologies Inc. inched 0.57% higher to $438.71 Tuesday, on what proved to be an all-around mixed trading session for the stock market, with...""}, {""date"": ""20230411181944"", ""headline"": ""10 Best Mid-Cap Dividend Aristocrats To Buy"", ""summary"": ""In this article, we discuss 10 best mid-cap dividend aristocrats to buy. You can skip our detailed analysis of dividend stocks and their performance, and go directly to read 5 Best Mid-Cap Dividend Aristocrats To Buy. Due to their limited volatility, mid-cap stocks have exhibited solid performance over the years. According to a report by [\u2026]""}, {""date"": ""20230412132100"", ""headline"": ""Roper Technologies Inc. stock outperforms competitors on strong trading day"", ""summary"": ""Shares of Roper Technologies Inc. inched 0.86% higher to $442.48 Wednesday, on what proved to be an all-around grim trading session for the stock market,...""}, {""date"": ""20230413132100"", ""headline"": ""Roper Technologies Inc. stock rises Thursday, still underperforms market"", ""summary"": ""Shares of Roper Technologies Inc. inched 0.01% higher to $442.51 Thursday, on what proved to be an all-around great trading session for the stock market,...""}, {""date"": ""20230414132100"", ""headline"": ""Roper Technologies Inc. stock underperforms Friday when compared to competitors"", ""summary"": ""Shares of Roper Technologies Inc. slumped 0.59% to $439.91 Friday, on what proved to be an all-around dismal trading session for the stock market, with the...""}, {""date"": ""20230416004354"", ""headline"": ""Dividend Champion, Contender, And Challenger Highlights: Week Of April 16"", ""summary"": ""In this weekly series, I highlight recent and upcoming dividend related activity for dividend stocks. Read more to see the weekly summary of dividend activity.""}]","{""assetTurnoverTTM"": 0.2142, ""bookValue"": 16332.7, ""cashRatio"": 0.42574043381134247, ""currentRatio"": 0.8043, ""ebitPerShare"": 3.7477, ""eps"": 2.6458, ""ev"": 52302.648, ""fcfMargin"": 0.3021, ""fcfPerShareTTM"": 6.0755, ""grossMargin"": 0.6931, ""inventoryTurnoverTTM"": 10.6232, ""longtermDebtTotalAsset"": 0.2198, ""longtermDebtTotalCapital"": 0.2594, ""longtermDebtTotalEquity"": 0.3652, ""netDebtToTotalCapital"": 0.2384, ""netDebtToTotalEquity"": 0.3357, ""netMargin"": 0.1926, ""operatingMargin"": 0.2728, ""payoutRatioTTM"": 0.0959, ""pb"": 2.8667, ""peTTM"": 16.6781, ""pfcfTTM"": 64.4997, ""pretaxMargin"": 0.245, ""psTTM"": 8.4184, ""ptbv"": 5.5337, ""quickRatio"": 0.7628, ""receivablesTurnoverTTM"": 6.9726, ""roaTTM"": 0.1081, ""roeTTM"": 0.1873, ""roicTTM"": 0.1285, ""rotcTTM"": 0.0718, ""salesPerShare"": 13.7355, ""sgaToSale"": 0.3069, ""tangibleBookValue"": 8461, ""totalDebtToEquity"": 0.408, ""totalDebtToTotalAsset"": 0.2456, ""totalDebtToTotalCapital"": 0.2898, ""totalRatio"": 2.512, ""period"": ""2023-03-31""}"
14,2023-04-16,438.0364990234375,2023-04-23,443.5130615234375,0.012502525502348538,U2,"[{""date"": ""20230416004354"", ""headline"": ""Dividend Champion, Contender, And Challenger Highlights: Week Of April 16"", ""summary"": ""In this weekly series, I highlight recent and upcoming dividend related activity for dividend stocks. Read more to see the weekly summary of dividend activity.""}, {""date"": ""20230417074200"", ""headline"": ""Profit from the Artificial Intelligence Boom with These 7 AI ETFs"", ""summary"": ""Looking for stock market analysis and research with proves results? Zacks.com offers in-depth financial research with over 30years of proven results.""}, {""date"": ""20230417132100"", ""headline"": ""Roper Technologies Inc. stock outperforms competitors on strong trading day"", ""summary"": ""Shares of Roper Technologies Inc. inched 0.68% higher to $442.92 Monday, on what proved to be an all-around great trading session for the stock market, with...""}, {""date"": ""20230418132100"", ""headline"": ""Roper Technologies Inc. stock outperforms competitors despite losses on the day"", ""summary"": ""Shares of Roper Technologies Inc. dropped 0.27% to $441.72 Tuesday, on what proved to be an all-around mixed trading session for the stock market, with the...""}, {""date"": ""20230419090200"", ""headline"": ""Aderant Introduces Onyx: Law Firms\u2019 OCG Compliance Chaos is About to End"", ""summary"": ""ATLANTA, April 19, 2023--Aderant announced upcoming launch of Onyx, a revolutionary AI-powered solution to transform Outside Counsel Guideline (OCG) compliance for law firms.""}, {""date"": ""20230419132100"", ""headline"": ""Roper Technologies Inc. stock underperforms Wednesday when compared to competitors despite daily gains"", ""summary"": ""Shares of Roper Technologies Inc. inched 0.30% higher to $443.06 Wednesday, on what proved to be an all-around dismal trading session for the stock market,...""}, {""date"": ""20230420132100"", ""headline"": ""Roper Technologies Inc. stock outperforms market on strong trading day"", ""summary"": ""Shares of Roper Technologies Inc. inched 0.03% higher to $443.19 Thursday, on what proved to be an all-around rough trading session for the stock market,...""}, {""date"": ""20230421002300"", ""headline"": ""Roper Technologies Inc. stock rises Friday, outperforms market"", ""summary"": ""Looking for stock market analysis and research with proves results? Zacks.com offers in-depth financial research with over 30years of proven results.""}, {""date"": ""20230421090701"", ""headline"": ""Roper (ROP) to Report Q1 Earnings: What's in the Offing?"", ""summary"": ""Roper's (ROP) Q1 performance is likely to have benefited by strength in its Application Software segment, partly offset by raw material cost inflation and supply-chain issues.""}, {""date"": ""20230423144358"", ""headline"": ""7 Tech Stocks to Buy Now and Hold Forever"", ""summary"": ""After a disastrous year to forget, some of the best tech stocks to buy have kicked off a comeback year. Better, these beaten-down stocks make for great long-term, core portfolio positions \u2014 each a high-quality tech company, with deep economic moats. In fact, with strong track records of steady, consistent growth, over time they are poised to continue appreciating in value at a more-than-satisfactory clip. In some cases, these blue-chip tech names also provide investors with dividends. These prov""}]",{}
15,2023-04-23,443.5130615234375,2023-04-30,452.8431396484375,0.021036760660332776,U3,"[{""date"": ""20230423144358"", ""headline"": ""7 Tech Stocks to Buy Now and Hold Forever"", ""summary"": ""After a disastrous year to forget, some of the best tech stocks to buy have kicked off a comeback year. Better, these beaten-down stocks make for great long-term, core portfolio positions \u2014 each a high-quality tech company, with deep economic moats. In fact, with strong track records of steady, consistent growth, over time they are poised to continue appreciating in value at a more-than-satisfactory clip. In some cases, these blue-chip tech names also provide investors with dividends. These prov""}, {""date"": ""20230424002300"", ""headline"": ""Roper Technologies Inc. stock rises Monday, outperforms market"", ""summary"": ""Looking for stock market analysis and research with proves results? Zacks.com offers in-depth financial research with over 30years of proven results.""}, {""date"": ""20230424132800"", ""headline"": ""DAT Truckload Volume Index: Spot Rates Slipped Further in March"", ""summary"": ""BEAVERTON, Ore., April 24, 2023--The DAT Truckload Volume Index (TVI) increased for all three equipment types for the first time since July 2022, but national average spot van and refrigerated (\""reefer\"") rates plunged to two-and-half-year lows in March, said DAT Freight & Analytics, which operates the industry\u2019s largest online freight marketplace and DAT iQ data analytics service.""}, {""date"": ""20230425062041"", ""headline"": ""Those who invested in Roper Technologies (NYSE:ROP) five years ago are up 74%"", ""summary"": ""When we invest, we're generally looking for stocks that outperform the market average. And while active stock picking...""}, {""date"": ""20230425132100"", ""headline"": ""Roper Technologies Inc. stock falls Tuesday, underperforms market"", ""summary"": ""Shares of Roper Technologies Inc. slipped 2.32% to $437.36 Tuesday, on what proved to be an all-around poor trading session for the stock market, with the...""}, {""date"": ""20230426023746"", ""headline"": ""14 Best Income Stocks To Invest In"", ""summary"": ""In this article, we discuss 14 best income stocks to invest in. You can skip our detailed analysis of income stocks and the performance of dividend stocks over the years, and go directly to read 5 Best Income Stocks To Invest In. Income stocks are picking up steam this year because they offer a relatively [\u2026]""}, {""date"": ""20230426030900"", ""headline"": ""Honeywell to acquire Compressor Controls Corporation for $670M"", ""summary"": ""Looking for stock market analysis and research with proves results? Zacks.com offers in-depth financial research with over 30years of proven results.""}, {""date"": ""20230426033400"", ""headline"": ""Honeywell to buy Compressor Controls in $670M deal"", ""summary"": ""Looking for stock market analysis and research with proves results? Zacks.com offers in-depth financial research with over 30years of proven results.""}, {""date"": ""20230426041400"", ""headline"": ""Honeywell Buying Compressor Controls for $670M in Cash"", ""summary"": ""By Chris Wack Honeywell International Inc. said Wednesday it is buying Compressor Controls Corp. from Indicor LLC, which is owned by funds affiliated with...""}, {""date"": ""20230426042500"", ""headline"": ""Honeywell buying Compressor Controls Corp. for $670 mln in deal that will add to its earnings"", ""summary"": ""Honeywell International Inc. said Wednesday it will pay $670 million to buy Compressor Controls Corp. from private equity firm Clayton, Dubilier & Rice and...""}, {""date"": ""20230426061200"", ""headline"": ""Notable earnings before Thursday`s open"", ""summary"": ""Looking for stock market analysis and research with proves results? Zacks.com offers in-depth financial research with over 30years of proven results.""}, {""date"": ""20230426074100"", ""headline"": ""Roper Q1 2023 Earnings Preview"", ""summary"": ""Looking for stock market analysis and research with proves results? Zacks.com offers in-depth financial research with over 30years of proven results.""}, {""date"": ""20230426132100"", ""headline"": ""Roper Technologies Inc. stock outperforms competitors despite losses on the day"", ""summary"": ""Shares of Roper Technologies Inc. shed 1.44% to $431.05 Wednesday, on what proved to be an all-around rough trading session for the stock market, with the...""}, {""date"": ""20230426230500"", ""headline"": ""Roper Technologies (ROP) Gets a Hold from Goldman Sachs"", ""summary"": ""Looking for stock market analysis and research with proves results? Zacks.com offers in-depth financial research with over 30years of proven results.""}, {""date"": ""20230427020300"", ""headline"": ""Roper Non-GAAP EPS of $3.90 beats by $0.04, revenue of $1.47B beats by $20M"", ""summary"": ""Looking for stock market analysis and research with proves results? Zacks.com offers in-depth financial research with over 30years of proven results.""}, {""date"": ""20230427020700"", ""headline"": ""Roper Technologies reports Q1 adjusted EPS $3.90, consensus $3.85"", ""summary"": ""Looking for stock market analysis and research with proves results? Zacks.com offers in-depth financial research with over 30years of proven results.""}, {""date"": ""20230427020800"", ""headline"": ""Roper Technologies sees Q2 adjusted EPS $3.96-$4.00, consensus $3.96"", ""summary"": ""Looking for stock market analysis and research with proves results? Zacks.com offers in-depth financial research with over 30years of proven results.""}, {""date"": ""20230427020800"", ""headline"": ""Roper Technologies raises FY23 adj. EPS view to $16.10-$16.30 from $15.90-$16.20"", ""summary"": ""Looking for stock market analysis and research with proves results? Zacks.com offers in-depth financial research with over 30years of proven results.""}, {""date"": ""20230427030700"", ""headline"": ""Roper Technologies: Q1 Earnings Snapshot"", ""summary"": ""Looking for stock market analysis and research with proves results? Zacks.com offers in-depth financial research with over 30years of proven results.""}, {""date"": ""20230427065500"", ""headline"": ""Roper Technologies announces first quarter financial results"", ""summary"": ""Increasing full year guidanceSARASOTA, Fla., April 27, 2023 (GLOBE NEWSWIRE) -- Roper Technologies, Inc. (NYSE: ROP) reported financial results for the first quarter ended March 31, 2023. The results in this press release are presented on a continuing operations basis. First quarter 2023 highlights Revenue increased 15% to $1.47 billion; organic revenue +8%GAAP DEPS increased 20% to $2.66; adjusted DEPS +19% to $3.90GAAP net earnings increased 20% to $284 millionAdjusted EBITDA increased 15% to""}, {""date"": ""20230427073025"", ""headline"": ""Roper Technologies Inc. (ROP) Q1 2023 Earnings Call Transcript"", ""summary"": ""Roper Technologies Inc. (NYSE:NYSE:ROP) Q1 2023 Earnings Conference Call April 27, 2023 8:00 AM ETCompany ParticipantsZack Moxcey - Vice President of Investor RelationsNeil Hunn - President...""}, {""date"": ""20230427081512"", ""headline"": ""Roper Technologies (ROP) Q1 Earnings and Revenues Beat Estimates"", ""summary"": ""Roper Technologies (ROP) delivered earnings and revenue surprises of 1.30% and 1.92%, respectively, for the quarter ended March 2023. Do the numbers hold clues to what lies ahead for the stock?""}, {""date"": ""20230427093001"", ""headline"": ""Roper Technologies (ROP) Q1 Earnings: Taking a Look at Key Metrics Versus Estimates"", ""summary"": ""Although the revenue and EPS for Roper Technologies (ROP) give a sense of how its business performed in the quarter ended March 2023, it might be worth considering how some key metrics compare with Wall Street estimates and the year-ago numbers.""}, {""date"": ""20230427132205"", ""headline"": ""Roper (ROP) Q1 Earnings & Revenues Surpass Estimates"", ""summary"": ""Roper's (ROP) Q1 earnings reflect gains from solid segmental performances.""}, {""date"": ""20230427132300"", ""headline"": ""Roper Technologies Inc. stock outperforms market on strong trading day"", ""summary"": ""Shares of Roper Technologies Inc. rose 5.09% to $452.98 Thursday, on what proved to be an all-around favorable trading session for the stock market, with the...""}, {""date"": ""20230427220217"", ""headline"": ""3 Innovative Water Tech Stocks to Watch in a Thirsty World"", ""summary"": ""If you\u2019re interested in investing in water tech stocks, you\u2019d be wise to turn to Invesco. It\u2019s cornered the market on water technology companies, marketing three of the top water exchange-traded funds (ETFs) listed on U.S. stock exchanges: Invesco Water Resources ETF (NASDAQ:PHO), Invesco S&P Global Water Index ETF (NYSEARCA:CGW) and Invesco Global Water ETF (NASDAQ:PIO). According to an Invesco white paper, global water resources fell by 56% between 1962 and 2014. Water scarcity solutions have""}, {""date"": ""20230427234904"", ""headline"": ""Q1 2023 Roper Technologies Inc Earnings Call"", ""summary"": ""Q1 2023 Roper Technologies Inc Earnings Call""}, {""date"": ""20230428025500"", ""headline"": ""Roper Technologies price target raised to $540 from $525 at Truist"", ""summary"": ""Looking for stock market analysis and research with proves results? Zacks.com offers in-depth financial research with over 30years of proven results.""}, {""date"": ""20230428132100"", ""headline"": ""Roper Technologies Inc. stock rises Friday, still underperforms market"", ""summary"": ""Shares of Roper Technologies Inc. inched 0.40% higher to $454.78 Friday, on what proved to be an all-around great trading session for the stock market, with...""}, {""date"": ""20230428235304"", ""headline"": ""Synopsys: Robust Semi Exposure To Deal Calmly With Recession Fears"", ""summary"": ""Synopsys is supported by strong tailwinds such as China's rising Chip Industry, EV and AI-driven solutions adoption. See why SNPS is my top idea for a recession.""}]",{}
