,Start Date,Start Price,End Date,End Price,Weekly Returns,Bin Label,News,Basics
40,2023-10-15,59.382137298583984,2023-10-22,56.9029426574707,-0.041749838485055646,D5,"[{""date"": ""2023-10-16"", ""headline"": ""Fastenal Co. stock falls Monday, underperforms market"", ""summary"": ""Shares of Fastenal Co. slid 0.40% to $59.88 Monday, on what proved to be an all-around positive trading session for the stock market, with the S&P 500 Index...""}, {""date"": ""2023-10-16"", ""headline"": ""Fastenal (FAST) Hits 52-Week High on Higher Sales & Gross Margin"", ""summary"": ""Fastenal (FAST) touches the 52-week high on improved daily sales and gross margin.""}, {""date"": ""2023-10-16"", ""headline"": ""Fastenal Company (NASDAQ:FAST) Q3 2023 Earnings Call Transcript"", ""summary"": ""Fastenal Company (NASDAQ:FAST) Q3 2023 Earnings Call Transcript October 12, 2023 Fastenal Company beats earnings expectations. Reported EPS is $0.52, expectations were $0.51. Operator: Hello, and welcome to the Fastenal 2023 Q3 Earnings Results Conference Call and Webcast. [Operator Instructions] A question-and-answer session will follow the formal presentation. [Operator Instructions] As a reminder, this conference [\u2026]""}, {""date"": ""2023-10-16"", ""headline"": ""Here's How Much a $1000 Investment in Fastenal Made 10 Years Ago Would Be Worth Today"", ""summary"": ""Why investing for the long run, especially if you buy certain popular stocks, could reap huge rewards.""}, {""date"": ""2023-10-17"", ""headline"": ""Fastenal Co. stock outperforms market on strong trading day"", ""summary"": ""Shares of Fastenal Co. inched 0.30% higher to $60.06 Tuesday, on what proved to be an all-around mixed trading session for the stock market, with the Dow...""}, {""date"": ""2023-10-17"", ""headline"": ""Why Fastenal (FAST) is a Top Momentum Stock for the Long-Term"", ""summary"": ""The Zacks Style Scores offers investors a way to easily find top-rated stocks based on their investing style. Here's why you should take advantage.""}, {""date"": ""2023-10-17"", ""headline"": ""A Positive Rate Of Change In Manufacturing"", ""summary"": ""Manufacturing sector shows signs of rebound, with PMI increasing and sub-components improving. Click here to read my thoughts.""}, {""date"": ""2023-10-17"", ""headline"": ""J.P. Morgan Sticks to Their Hold Rating for Fastenal Company (FAST)"", ""summary"": ""Looking for stock market analysis and research with proves results? Zacks.com offers in-depth financial research with over 30years of proven results.""}, {""date"": ""2023-10-18"", ""headline"": ""Fastenal Co. stock falls Wednesday, underperforms market"", ""summary"": ""Shares of Fastenal Co. slipped 2.11% to $58.79 Wednesday, on what proved to be an all-around grim trading session for the stock market, with the S&P 500...""}, {""date"": ""2023-10-18"", ""headline"": ""Why Fastenal (FAST) is a Top Growth Stock for the Long-Term"", ""summary"": ""The Zacks Style Scores offers investors a way to easily find top-rated stocks based on their investing style. Here's why you should take advantage.""}, {""date"": ""2023-10-18"", ""headline"": ""$1000 Invested In This Stock 5 Years Ago Would Be Worth $2,300 Today"", ""summary"": ""Looking for stock market analysis and research with proves results? Zacks.com offers in-depth financial research with over 30years of proven results.""}, {""date"": ""2023-10-19"", ""headline"": ""Fastenal Co. stock outperforms market despite losses on the day"", ""summary"": ""Shares of Fastenal Co. slumped 0.44% to $58.53 Thursday, on what proved to be an all-around rough trading session for the stock market, with the S&P 500...""}, {""date"": ""2023-10-19"", ""headline"": ""The 7 Best Nasdaq Stocks To Buy Now: October 2023"", ""summary"": ""Nasdaq stocks generally equate to higher-growth, technology-dominated firms in the eyes of most investors. The index is generally more rate-sensitive than leading indexes like the Dow and the S&P 500. This growth has led to the rise of the best Nasdaq stocks to buy. In any case, the Nasdaq contains more than 3,300 publicly listed firms and is also a stock exchange and not only an index. Its counterpart, the New York Stock Exchange, includes less than 3,000 publicly listed firms. In 2023, Nasdaq-""}, {""date"": ""2023-10-19"", ""headline"": ""Fastenal and the National Hockey League Announce Multiyear Global Partnership Extension"", ""summary"": ""NEW YORK & WINONA, Minn., October 19, 2023--Fastenal Company (Nasdaq: FAST), a global leader in supply chain solutions and industrial distribution, and the National Hockey League (NHL\u00ae) today announced a multiyear global partnership extension. The renewed partnership expands Fastenal's international NHL presence to include presenting sponsorship of all NHL Global Series European games, as well as the NHL's primetime international broadcast series NHL Saturday and NHL Sunday.""}, {""date"": ""2023-10-19"", ""headline"": ""Fastenal and NHL announce multiyear global partnership extension"", ""summary"": ""Looking for stock market analysis and research with proves results? Zacks.com offers in-depth financial research with over 30years of proven results.""}, {""date"": ""2023-10-20"", ""headline"": ""Fastenal Co. stock falls Friday, underperforms market"", ""summary"": ""Shares of Fastenal Co. shed 1.57% to $57.61 Friday, on what proved to be an all-around poor trading session for the stock market, with the S&P 500 Index...""}, {""date"": ""2023-10-22"", ""headline"": ""Dividend Champion, Contender, And Challenger Highlights: Week Of October 22"", ""summary"": ""A weekly summary of dividend activity for Dividend Champions, Contenders, and Challengers. Click here to read more.""}]",{}
41,2023-10-22,56.9029426574707,2023-10-29,57.25094223022461,0.0061156691816222075,U1,"[{""date"": ""2023-10-22"", ""headline"": ""Dividend Champion, Contender, And Challenger Highlights: Week Of October 22"", ""summary"": ""A weekly summary of dividend activity for Dividend Champions, Contenders, and Challengers. Click here to read more.""}, {""date"": ""2023-10-23"", ""headline"": ""Fastenal Co. stock underperforms Monday when compared to competitors"", ""summary"": ""Shares of Fastenal Co. slumped 0.40% to $57.38 Monday, on what proved to be an all-around grim trading session for the stock market, with the S&P 500 Index...""}, {""date"": ""2023-10-23"", ""headline"": ""Fastenal Out-Executing A Sluggish Market"", ""summary"": ""Fastenal's strong quarter results exceed expectations, driven by growth initiatives, while uncertainties loom for the manufacturing sector in 2024. Click here to read.""}, {""date"": ""2023-10-23"", ""headline"": ""Ex-Dividend Reminder: Fastenal, Royal Bank of Canada and AptarGroup"", ""summary"": ""Looking for stock market analysis and research with proves results? Zacks.com offers in-depth financial research with over 30years of proven results.""}, {""date"": ""2023-10-24"", ""headline"": ""Fastenal Co. stock rises Tuesday, still underperforms market"", ""summary"": ""Shares of Fastenal Co. inched 0.35% higher to $57.58 Tuesday, on what proved to be an all-around great trading session for the stock market, with the S&P 500...""}, {""date"": ""2023-10-24"", ""headline"": ""Fastenal Co's Dividend Analysis"", ""summary"": ""Fastenal Co (NASDAQ:FAST) recently announced a dividend of $0.35 per share, payable on 2023-11-24, with the ex-dividend date set for 2023-10-25.  As investors look forward to this upcoming payment, the spotlight also shines on the company's dividend history, yield, and growth rates.  Using the data from GuruFocus, let's look into Fastenal Co's dividend performance and assess its sustainability.""}, {""date"": ""2023-10-24"", ""headline"": ""Hey, Warren! 3 Stocks Buffett Should Buy Now."", ""summary"": ""Looking for stock market analysis and research with proves results? Zacks.com offers in-depth financial research with over 30years of proven results.""}, {""date"": ""2023-10-25"", ""headline"": ""Fastenal Co. stock outperforms competitors despite losses on the day"", ""summary"": ""Shares of Fastenal Co. slid 0.26% to $57.08 Wednesday, on what proved to be an all-around grim trading session for the stock market, with the S&P 500 Index...""}, {""date"": ""2023-10-26"", ""headline"": ""Best High Growth Dividend Stocks - From The 4 Factor Strategy"", ""summary"": ""The 4 factor dividend growth strategy aims to blend the ease of investing in an ETF with the appeal of holding individual stocks. Click here to read more.""}, {""date"": ""2023-10-27"", ""headline"": ""Fastenal Co. stock outperforms market on strong trading day"", ""summary"": ""Shares of Fastenal Co. inched 0.65% higher to $57.61 Friday, on what proved to be an all-around dismal trading session for the stock market, with the S&P 500...""}, {""date"": ""2023-10-27"", ""headline"": ""MSC Industrial Outperforming An Increasingly Challenging Market"", ""summary"": ""MSC Industrial's strong performance in FQ4 and fiscal year, driven by share gains and margin improvement, positions it for continued growth despite some macro concerns. Click here to read.""}]",{}
42,2023-10-29,57.25094223022461,2023-11-05,59.42729187011719,0.0380142152270746,U4,"[{""date"": ""2023-10-30"", ""headline"": ""Fastenal Co. stock rises Monday, still underperforms market"", ""summary"": ""Shares of Fastenal Co. advanced 1.08% to $58.23 Monday, on what proved to be an all-around positive trading session for the stock market, with the S&P 500...""}, {""date"": ""2023-10-30"", ""headline"": ""Are Retail-Wholesale Stocks Lagging  Deckers Outdoor (DECK) This Year?"", ""summary"": ""Here is how Deckers (DECK) and Fastenal (FAST) have performed compared to their sector so far this year.""}, {""date"": ""2023-10-30"", ""headline"": ""Fastenal (FAST) Crossed Above the 20-Day Moving Average: What That Means for Investors"", ""summary"": ""Is it a good or bad thing when a stock surpasses resistance at the 20-day simple moving average?""}, {""date"": ""2023-10-31"", ""headline"": ""Fastenal Co. stock rises Tuesday, still underperforms market"", ""summary"": ""Shares of Fastenal Co. inched 0.19% higher to $58.34 Tuesday, on what proved to be an all-around positive trading session for the stock market, with the S&P...""}, {""date"": ""2023-11-01"", ""headline"": ""Fastenal Co. stock rises Wednesday, still underperforms market"", ""summary"": ""Shares of Fastenal Co. inched 0.98% higher to $58.91 Wednesday, on what proved to be an all-around positive trading session for the stock market, with the...""}, {""date"": ""2023-11-01"", ""headline"": ""Imperial Dade Appoints Terry Owen as Chief Operating Officer"", ""summary"": ""Looking for stock market analysis and research with proves results? Zacks.com offers in-depth financial research with over 30years of proven results.""}, {""date"": ""2023-11-02"", ""headline"": ""Fastenal Co. stock rises Thursday, still underperforms market"", ""summary"": ""Shares of Fastenal Co. rose 1.61% to $59.86 Thursday, on what proved to be an all-around great trading session for the stock market, with the S&P 500 Index...""}, {""date"": ""2023-11-02"", ""headline"": ""Here's Why Fastenal (FAST) is a Strong Momentum Stock"", ""summary"": ""The Zacks Style Scores offers investors a way to easily find top-rated stocks based on their investing style. Here's why you should take advantage.""}, {""date"": ""2023-11-03"", ""headline"": ""Fastenal Co. stock falls Friday, underperforms market"", ""summary"": ""Shares of Fastenal Co. slumped 0.10% to $59.80 Friday, on what proved to be an all-around great trading session for the stock market, with the S&P 500 Index...""}, {""date"": ""2023-11-04"", ""headline"": ""This Dividend Growth Stock Has a Problem the Market Is Missing Right Now"", ""summary"": ""Fastenal stock rose sharply when it reported third-quarter earnings, but there's still a lot of bad news in the mix.""}]",{}
43,2023-11-05,59.42729187011719,2023-11-12,59.635982513427734,0.003511697012319903,U1,"[{""date"": ""2023-11-06"", ""headline"": ""Fastenal Co. stock underperforms Monday when compared to competitors"", ""summary"": ""Shares of Fastenal Co. slid 1.81% to $58.72 Monday, on what proved to be an all-around great trading session for the stock market, with the S&P 500 Index...""}, {""date"": ""2023-11-06"", ""headline"": ""4 Factor Dividend Growth Portfolio: Year One Is On The Books"", ""summary"": ""The 4-factor dividend growth portfolio is a strategy that leverages the stock selection process of Schwab U.S. Dividend Equity ETF. Click here for more.""}, {""date"": ""2023-11-07"", ""headline"": ""Fastenal Co. stock underperforms Tuesday when compared to competitors despite daily gains"", ""summary"": ""Shares of Fastenal Co. inched 0.51% higher to $59.02 Tuesday, on what proved to be an all-around great trading session for the stock market, with the S&P 500...""}, {""date"": ""2023-11-07"", ""headline"": ""How to Boost Your Portfolio with Top Retail-Wholesale Stocks Set to Beat Earnings"", ""summary"": ""Why investors should use the Zacks Earnings ESP tool to help find stocks that are poised to top quarterly earnings estimates.""}, {""date"": ""2023-11-07"", ""headline"": ""Analysts Conflicted on These Industrial Goods Names: Atmus Filtration Technologies, Inc. (ATMU), JELD-WEN (JELD) and Fastenal Company (FAST)"", ""summary"": ""Looking for stock market analysis and research with proves results? Zacks.com offers in-depth financial research with over 30years of proven results.""}, {""date"": ""2023-11-08"", ""headline"": ""Fastenal Co. stock rises Wednesday, outperforms market"", ""summary"": ""Shares of Fastenal Co. inched 0.41% higher to $59.26 Wednesday, on what proved to be an all-around mixed trading session for the stock market, with the S&P...""}, {""date"": ""2023-11-08"", ""headline"": ""If You Invested $1000 in Fastenal a Decade Ago, This is How Much It'd Be Worth Now"", ""summary"": ""Investing in certain stocks can pay off in the long run, especially if you hold on for a decade or more.""}, {""date"": ""2023-11-09"", ""headline"": ""Fastenal Co. stock outperforms market despite losses on the day"", ""summary"": ""Shares of Fastenal Co. sank 0.22% to $59.13 Thursday, on what proved to be an all-around dismal trading session for the stock market, with the S&P 500 Index...""}, {""date"": ""2023-11-10"", ""headline"": ""Fastenal Co. stock rises Friday, still underperforms market"", ""summary"": ""Shares of Fastenal Co. rose 1.49% to $60.01 Friday, on what proved to be an all-around positive trading session for the stock market, with the S&P 500 Index...""}, {""date"": ""2023-11-11"", ""headline"": ""Why You Should Aim For $2 Million For Retirement"", ""summary"": ""Retirement goals should be set based on individual situations and factors like your pre-retirement earnings. Explore more details here.""}]",{}
44,2023-11-12,59.635982513427734,2023-11-19,60.37137222290039,0.012331308691142517,U2,"[{""date"": ""2023-11-13"", ""headline"": ""Builders FirstSource Is A Good Buy At Current Levels"", ""summary"": ""Builders FirstSource's revenue outlook is positive, with indications that the housing market is near the bottom of the current cycle. Read why BLDR stock is a Buy.""}, {""date"": ""2023-11-14"", ""headline"": ""Fastenal CEO Daniel Florness sells $1.2M inciompany shares"", ""summary"": ""Looking for stock market analysis and research with proves results? Zacks.com offers in-depth financial research with over 30years of proven results.""}, {""date"": ""2023-11-14"", ""headline"": ""Here's How Much You Would Have Made Owning Fastenal Stock In The Last 5 Years"", ""summary"": ""Looking for stock market analysis and research with proves results? Zacks.com offers in-depth financial research with over 30years of proven results.""}, {""date"": ""2023-11-15"", ""headline"": ""Fastenal Co. stock outperforms competitors despite losses on the day"", ""summary"": ""Shares of Fastenal Co. shed 1.46% to $60.11 Wednesday, on what proved to be an all-around great trading session for the stock market, with the S&P 500 Index...""}, {""date"": ""2023-11-15"", ""headline"": ""Are Retail-Wholesale Stocks Lagging  Deckers Outdoor (DECK) This Year?"", ""summary"": ""Here is how Deckers (DECK) and Fastenal (FAST) have performed compared to their sector so far this year.""}, {""date"": ""2023-11-15"", ""headline"": ""Here's Why We Think Fastenal (NASDAQ:FAST) Might Deserve Your Attention Today"", ""summary"": ""Investors are often guided by the idea of discovering 'the next big thing', even if that means buying 'story stocks...""}, {""date"": ""2023-11-15"", ""headline"": ""RSPN: Industrials Dashboard For November"", ""summary"": ""Discover the latest financial insights: the transportation industry shines, Invesco S&P 500 Equal Weight Industrials ETF offers advantages, click here for more.""}, {""date"": ""2023-11-16"", ""headline"": ""Fastenal Co. stock outperforms market on strong trading day"", ""summary"": ""Shares of Fastenal Co. inched 0.91% higher to $60.66 Thursday, on what proved to be an all-around mixed trading session for the stock market, with the S&P...""}, {""date"": ""2023-11-17"", ""headline"": ""Fastenal Co. stock rises Friday, outperforms market"", ""summary"": ""Shares of Fastenal Co. inched 0.15% higher to $60.75 Friday, on what proved to be an all-around favorable trading session for the stock market, with the S&P...""}, {""date"": ""2023-11-17"", ""headline"": ""Goldman Sachs 2024 stock strategy - high quality"", ""summary"": ""Looking for stock market analysis and research with proves results? Zacks.com offers in-depth financial research with over 30years of proven results.""}, {""date"": ""2023-11-18"", ""headline"": ""Dividend Champion, Contender, And Challenger Highlights: Week Of November 19"", ""summary"": ""The Dividend Champions list is a monthly compilation of companies which have consistently increased their annual dividend payouts. Explore more details here.""}]",{}
45,2023-11-19,60.37137222290039,2023-11-26,60.58006286621094,0.0034567815112771516,U1,"[{""date"": ""2023-11-18"", ""headline"": ""Dividend Champion, Contender, And Challenger Highlights: Week Of November 19"", ""summary"": ""The Dividend Champions list is a monthly compilation of companies which have consistently increased their annual dividend payouts. Explore more details here.""}, {""date"": ""2023-11-19"", ""headline"": ""Fastenal Co (FAST) 2022 President and CEO Daniel L. ..."", ""summary"": ""Looking for stock market analysis and research with proves results? Zacks.com offers in-depth financial research with over 30years of proven results.""}, {""date"": ""2023-11-20"", ""headline"": ""Fastenal Co. stock rises Monday, still underperforms market"", ""summary"": ""Shares of Fastenal Co. inched 0.28% higher to $60.92 Monday, on what proved to be an all-around great trading session for the stock market, with the S&P 500...""}, {""date"": ""2023-11-20"", ""headline"": ""Fastenal Company Announces Cash Dividend"", ""summary"": ""WINONA, Minn., November 20, 2023--Fastenal Company (Nasdaq:FAST) reported its board of directors declared a special one-time dividend of $0.38 per share to be paid in cash on December 20, 2023 to shareholders of record at the close of business on December 6, 2023. Except for share and per share information, dollar amounts are stated in millions.""}, {""date"": ""2023-11-20"", ""headline"": ""Fastenal declares $0.38 special dividend"", ""summary"": ""Looking for stock market analysis and research with proves results? Zacks.com offers in-depth financial research with over 30years of proven results.""}, {""date"": ""2023-11-21"", ""headline"": ""Fastenal Co. stock outperforms competitors despite losses on the day"", ""summary"": ""Shares of Fastenal Co. dropped 0.36% to $60.70 Tuesday, on what proved to be an all-around grim trading session for the stock market, with the S&P 500 Index...""}, {""date"": ""2023-11-21"", ""headline"": ""Why Fastenal (FAST) is a Top Momentum Stock for the Long-Term"", ""summary"": ""The Zacks Style Scores offers investors a way to easily find top-rated stocks based on their investing style. Here's why you should take advantage.""}, {""date"": ""2023-11-21"", ""headline"": ""QQQ ETF Update, 11/22/2023"", ""summary"": ""Looking for stock market analysis and research with proves results? Zacks.com offers in-depth financial research with over 30years of proven results.""}, {""date"": ""2023-11-21"", ""headline"": ""3 Elite Dividend-Paying Stocks to Hold for Eons"", ""summary"": ""Looking for stock market analysis and research with proves results? Zacks.com offers in-depth financial research with over 30years of proven results.""}, {""date"": ""2023-11-21"", ""headline"": ""Fastenal Company Is On Sale Again"", ""summary"": ""Fastenal's balance sheet, revenue growth, and earnings growth all meet positive criteria. Read why my analysis of FAST stock suggests a buy rating.""}, {""date"": ""2023-11-22"", ""headline"": ""Fastenal Co. stock rises Wednesday, still underperforms market"", ""summary"": ""Shares of Fastenal Co. inched 0.28% higher to $60.87 Wednesday, on what proved to be an all-around positive trading session for the stock market, with the...""}, {""date"": ""2023-11-22"", ""headline"": ""PAVE: Expecting Further Infrastructure Strength Heading Into 2024"", ""summary"": ""The Global X U.S. Infrastructure Development ETF is focused on the Industrials sector and has a diversified portfolio. Read more to see our analysis on PAVE.""}, {""date"": ""2023-11-23"", ""headline"": ""QQQ ETF Update, 11/24/2023"", ""summary"": ""Looking for stock market analysis and research with proves results? Zacks.com offers in-depth financial research with over 30years of proven results.""}, {""date"": ""2023-11-23"", ""headline"": ""Billionaire Paul Tudor Jones and Insiders Love These 11 Stocks"", ""summary"": ""In this piece, we will take a look at the stocks that billionaire Paul Tudor Jones and insiders love. If you want to skip our introduction to Paul Tudor Jones and his hedge fund, then take a look at Billionaire Paul Tudor Jones and Insiders Love These Stocks: Top 5 Stocks. Paul Tudor Jones is [\u2026]""}, {""date"": ""2023-11-24"", ""headline"": ""Fastenal (FAST) Beats Stock Market Upswing: What Investors Need to Know"", ""summary"": ""In the closing of the recent trading day, Fastenal (FAST) stood at $60.96, denoting a +0.15% change from the preceding trading day.""}, {""date"": ""2023-11-24"", ""headline"": ""Fastenal Co. stock outperforms competitors on strong trading day"", ""summary"": ""Shares of Fastenal Co. inched 0.15% higher to $60.96 Friday, on what proved to be an all-around favorable trading session for the stock market, with the S&P...""}]",{}
