,Start Date,Start Price,End Date,End Price,Weekly Returns,Bin Label,News,Basics
22,2023-06-11,449.8758239746094,2023-06-18,456.8261413574219,0.015449412954461783,U2,"[{""date"": ""20230611233300"", ""headline"": ""$100 Invested In Roper Techs 20 Years Ago Would Be Worth This Much Today"", ""summary"": ""Looking for stock market analysis and research with proves results? Zacks.com offers in-depth financial research with over 30years of proven results.""}, {""date"": ""20230612080000"", ""headline"": ""CBORD/Horizon Software Announces Appointment of Dan Park as President and Chief Executive Officer"", ""summary"": ""ITHACA, N.Y., June 12, 2023 (GLOBE NEWSWIRE) -- CBORD/Horizon Software, a business unit of Roper Technologies (NYSE: ROP), today announced the appointment of Dan Park as President and Chief Executive Officer. CBORD/Horizon is a leading provider of software that connects foodservice, commerce, and housing systems on education, healthcare, and business campuses. Park brings over three decades of experience building and leading teams at retail and technology companies, including Amazon and Target.""}, {""date"": ""20230612110441"", ""headline"": ""Can Roper Technologies, Inc. (NYSE:ROP) Performance Keep Up Given Its Mixed Bag Of Fundamentals?"", ""summary"": ""Roper Technologies' (NYSE:ROP) stock is up by 5.5% over the past three months. Given that the stock prices usually...""}, {""date"": ""20230612124900"", ""headline"": ""Roper Technologies Inc. stock rises Monday, still underperforms market"", ""summary"": ""Shares of Roper Technologies Inc. inched 0.49% higher to $454.01 Monday, on what proved to be an all-around favorable trading session for the stock market,...""}, {""date"": ""20230613135200"", ""headline"": ""Roper Technologies Inc. stock rises Tuesday, still underperforms market"", ""summary"": ""Shares of Roper Technologies Inc. inched 0.42% higher to $455.92 Tuesday, on what proved to be an all-around great trading session for the stock market, with...""}, {""date"": ""20230614092000"", ""headline"": ""IntelliTrans Receives 2023 Top Supply Chain Projects Award from Supply & Demand Chain Executive"", ""summary"": ""This award profiles innovative case study-type projects designed to automate, optimize, streamline, and improve the supply chainATLANTA, June 14, 2023 (GLOBE NEWSWIRE) -- IntelliTrans, a leader in global multimodal solutions for optimizing supply chain operations for bulk & break-bulk industries, announces being named a winner of a 2023 Top Supply Chain Projects Award from Supply & Demand Chain Executive, the only publication covering the entire global supply chain. These awards profile innovati""}, {""date"": ""20230614124900"", ""headline"": ""Roper Technologies Inc. stock outperforms competitors on strong trading day"", ""summary"": ""Shares of Roper Technologies Inc. inched 0.11% higher to $456.44 Wednesday, on what proved to be an all-around mixed trading session for the stock market,...""}, {""date"": ""20230614220700"", ""headline"": ""Roper Technologies management to meet virtually with Oppenheimer"", ""summary"": ""Looking for stock market analysis and research with proves results? Zacks.com offers in-depth financial research with over 30years of proven results.""}, {""date"": ""20230615081600"", ""headline"": ""Roper declares $0.6825 dividend"", ""summary"": ""Looking for stock market analysis and research with proves results? Zacks.com offers in-depth financial research with over 30years of proven results.""}, {""date"": ""20230615090000"", ""headline"": ""Roper Technologies announces dividend"", ""summary"": ""Looking for stock market analysis and research with proves results? Zacks.com offers in-depth financial research with over 30years of proven results.""}, {""date"": ""20230615124900"", ""headline"": ""Roper Technologies Inc. stock rises Thursday, still underperforms market"", ""summary"": ""Shares of Roper Technologies Inc. rose 1.03% to $461.14 Thursday, on what proved to be an all-around positive trading session for the stock market, with the...""}, {""date"": ""20230615145400"", ""headline"": ""iPipeline\u00ae Creates Dedicated Team to Enhance the Customer Experience and Help Customers Achieve Their Business Goals"", ""summary"": ""As part of its ongoing commitment to strategically transform the life insurance and financial services industries through its innovative technology solutions, iPipeline\u00ae announces the establishment of a dedicated customer success initiative. Leading this firm-wide initiative to ensure customers realize maximum value from the company's solutions is Leonid Davelman, iPipeline's new Vice President of Customer Success.""}, {""date"": ""20230616021839"", ""headline"": ""Roper Technologies: Incredibly Profitable M&A Strategy That Wins"", ""summary"": ""Roper's strategy is to purchase high-quality, niche businesses with high margins and recurring revenue. See why ROP stock is rated buy.""}, {""date"": ""20230616124900"", ""headline"": ""Roper Technologies Inc. stock falls Friday, underperforms market"", ""summary"": ""Shares of Roper Technologies Inc. slumped 0.51% to $458.78 Friday, on what proved to be an all-around dismal trading session for the stock market, with the...""}]",{}
23,2023-06-18,456.8261413574219,2023-06-25,458.84747314453125,0.004424728806243783,U1,"[{""date"": ""20230620184300"", ""headline"": ""3 Dividend-Paying Technology Stocks With Big Growth"", ""summary"": ""While many income-focused investors target sectors such as utilities, finance, or consumer staples, the technology sector shouldn't be forgotten.""}, {""date"": ""20230620230000"", ""headline"": ""Aderant Transforming Legal Tech with Introduction of MADDI"", ""summary"": ""Looking for stock market analysis and research with proves results? Zacks.com offers in-depth financial research with over 30years of proven results.""}, {""date"": ""20230620235500"", ""headline"": ""Roper Technologies management to meet virtually with Oppenheimer"", ""summary"": ""Looking for stock market analysis and research with proves results? Zacks.com offers in-depth financial research with over 30years of proven results.""}, {""date"": ""20230621083000"", ""headline"": ""Roper Technologies schedules second quarter 2023 financial results conference call"", ""summary"": ""SARASOTA, Fla., June 21, 2023 (GLOBE NEWSWIRE) -- Roper Technologies, Inc. (NYSE: ROP) announced that its financial results for the second quarter of 2023, ended June 30, 2023, will be released before the market opens on Friday, July 21, 2023. A conference call to discuss these results has been scheduled for 8:00 AM ET on Friday, July 21, 2023. The call can be accessed via webcast or by dialing +1 844-750-4898 (US/Canada) or +1 412-317-5294, using confirmation number 10180010. Webcast informatio""}, {""date"": ""20230621090000"", ""headline"": ""iPipeline and Vertafore partner to simplify life insurance distribution for carriers and independent agents"", ""summary"": ""Vertafore\u00ae and iPipeline\u00ae, leading providers of software solutions for the insurance industry, today announced a strategic alliance to make the sales process for life insurance policies quicker and more streamlined.""}, {""date"": ""20230621124900"", ""headline"": ""Roper Technologies Inc. stock underperforms Wednesday when compared to competitors despite daily gains"", ""summary"": ""Shares of Roper Technologies Inc. inched 0.13% higher to $456.33 Wednesday, on what proved to be an all-around dismal trading session for the stock market,...""}, {""date"": ""20230622083000"", ""headline"": ""Roper Technologies announces move to Nasdaq"", ""summary"": ""SARASOTA, Fla., June 22, 2023 (GLOBE NEWSWIRE) -- Roper Technologies, Inc. (NYSE: ROP) today announced that it will transfer its stock exchange listing to the Nasdaq Stock Market (\u201cNasdaq\u201d) from the New York Stock Exchange. The Company expects to begin trading as a Nasdaq-listed company on July 6, 2023 and will continue to trade under the symbol \u201cROP.\u201d Upon transferring, Roper will become part of the Nasdaq Composite\u00ae Index and will also meet the eligibility requirements of the Nasdaq-100\u00ae Index""}, {""date"": ""20230622124900"", ""headline"": ""Roper Technologies Inc. stock rises Thursday, outperforms market"", ""summary"": ""Shares of Roper Technologies Inc. advanced 1.25% to $462.02 Thursday, on what proved to be an all-around mixed trading session for the stock market, with the...""}, {""date"": ""20230623000100"", ""headline"": ""Goldman adds 25 new stocks with growth potential to its ROE basket"", ""summary"": ""Looking for stock market analysis and research with proves results? Zacks.com offers in-depth financial research with over 30years of proven results.""}, {""date"": ""20230623055600"", ""headline"": ""Interesting ROP Put And Call Options For December 2024"", ""summary"": ""Looking for stock market analysis and research with proves results? Zacks.com offers in-depth financial research with over 30years of proven results.""}, {""date"": ""20230623110000"", ""headline"": ""Top Analyst Reports for Broadcom, Starbucks & Equinor"", ""summary"": ""Today's Research Daily features new research reports on 16 major stocks, including Broadcom Inc. (AVGO), Starbucks Corporation (SBUX) and Equinor ASA (EQNR).""}, {""date"": ""20230623124900"", ""headline"": ""Roper Technologies Inc. stock outperforms competitors despite losses on the day"", ""summary"": ""Shares of Roper Technologies Inc. slipped 0.26% to $460.81 Friday, on what proved to be an all-around poor trading session for the stock market, with the S&P...""}]",{}
24,2023-06-25,458.84747314453125,2023-07-02,478.7523498535156,0.04338015980032339,U5,"[{""date"": ""20230625215100"", ""headline"": ""Analysts Have Conflicting Sentiments on These Industrial Goods Companies: IDEX (IEX), Boeing (BA) and Roper Technologies (ROP)"", ""summary"": ""Looking for stock market analysis and research with proves results? Zacks.com offers in-depth financial research with over 30years of proven results.""}, {""date"": ""20230626095527"", ""headline"": ""My Highest Quality Dividend Champions"", ""summary"": ""The article presents the highest-quality Dividend Champions, which are companies listed on U.S. exchanges. Click here to read more.""}, {""date"": ""20230626124800"", ""headline"": ""Roper Technologies Inc. stock outperforms market despite losses on the day"", ""summary"": ""Shares of Roper Technologies Inc. shed 0.13% to $460.20 Monday, on what proved to be an all-around rough trading session for the stock market, with the S&P...""}, {""date"": ""20230626232600"", ""headline"": ""Roper Technologies (ROP) Receives a New Rating from Jefferies"", ""summary"": ""Looking for stock market analysis and research with proves results? Zacks.com offers in-depth financial research with over 30years of proven results.""}, {""date"": ""20230626233000"", ""headline"": ""Roper Technologies initiated with a Buy at Jefferies"", ""summary"": ""Looking for stock market analysis and research with proves results? Zacks.com offers in-depth financial research with over 30years of proven results.""}, {""date"": ""20230627034400"", ""headline"": ""Roper Technologies rated Buy in new coverage at Jefferies"", ""summary"": ""Looking for stock market analysis and research with proves results? Zacks.com offers in-depth financial research with over 30years of proven results.""}, {""date"": ""20230627050300"", ""headline"": ""Analyst Ratings for Roper Techs"", ""summary"": ""Looking for stock market analysis and research with proves results? Zacks.com offers in-depth financial research with over 30years of proven results.""}, {""date"": ""20230627060600"", ""headline"": ""Benzinga's Top Ratings Upgrades, Downgrades For June 27, 2023"", ""summary"": ""Looking for stock market analysis and research with proves results? Zacks.com offers in-depth financial research with over 30years of proven results.""}, {""date"": ""20230627150332"", ""headline"": ""Jefferies Initiates Coverage of Roper Technologies (ROP) with Buy Recommendation"", ""summary"": """"}, {""date"": ""20230627204053"", ""headline"": ""The 7 Most Undervalued Blue-Chip Stocks to Buy Now: June 2023"", ""summary"": ""Looking for undervalued blue-chip stocks to buy? This is a great time to be doing so. The stock market as a whole is enjoying a strong rally. And yet, there are still plenty of blue-chip stocks with high potential today. Investors might think that they have to give up the possibility of large capital gains to invest in safer conservative companies. But these seven best-value blue-chip stocks to buy offer upside at a good starting price. Morningstar agrees, with all seven of these picks being amo""}, {""date"": ""20230628000600"", ""headline"": ""$1000 Invested In Roper Techs 15 Years Ago Would Be Worth This Much Today"", ""summary"": ""Looking for stock market analysis and research with proves results? Zacks.com offers in-depth financial research with over 30years of proven results.""}, {""date"": ""20230628042000"", ""headline"": ""Wednesday\u2019s Top Analyst Upgrades and Downgrades: Alibaba, Alphabet, Antero Resources, Coterra Energy, GE HealthCare, Kellogg, SL Green Realty, Unity Software and More"", ""summary"": ""Looking for stock market analysis and research with proves results? Zacks.com offers in-depth financial research with over 30years of proven results.""}, {""date"": ""20230628124800"", ""headline"": ""Roper Technologies Inc. stock outperforms market on strong trading day"", ""summary"": ""Shares of Roper Technologies Inc. inched 0.06% higher to $471.14 Wednesday, on what proved to be an all-around rough trading session for the stock market,...""}, {""date"": ""20230629000600"", ""headline"": ""Goldman adds 39 new stocks to its Sharpe Ratio basket with megacaps absent"", ""summary"": ""Looking for stock market analysis and research with proves results? Zacks.com offers in-depth financial research with over 30years of proven results.""}, {""date"": ""20230629124800"", ""headline"": ""Roper Technologies Inc. stock underperforms Thursday when compared to competitors despite daily gains"", ""summary"": ""Shares of Roper Technologies Inc. rallied 1.06% to $476.13 Thursday, on what proved to be an all-around favorable trading session for the stock market, with...""}, {""date"": ""20230630124800"", ""headline"": ""Roper Technologies Inc. stock rises Friday, still underperforms market"", ""summary"": ""Shares of Roper Technologies Inc. inched 0.98% higher to $480.80 Friday, on what proved to be an all-around positive trading session for the stock market,...""}, {""date"": ""20230702020000"", ""headline"": ""10 Safest Dividend Aristocrats For 2023"", ""summary"": ""Looking for stock market analysis and research with proves results? Zacks.com offers in-depth financial research with over 30years of proven results.""}, {""date"": ""20230702040145"", ""headline"": ""Dividend Champion, Contender, And Challenger Highlights: Week Of July 2"", ""summary"": ""A weekly summary of dividend activity for Dividend Champions, Contenders, and Challengers. Click here to read more.""}]","{""assetTurnoverTTM"": 0.2182, ""bookValue"": 16745.9, ""cashRatio"": 0.529252143709975, ""currentRatio"": 0.9429, ""ebitPerShare"": 4.0531, ""eps"": 3.3976, ""ev"": 56452.847, ""fcfMargin"": 0.1927, ""fcfPerShareTTM"": 9.5679, ""grossMargin"": 0.6969, ""inventoryTurnoverTTM"": 16.6489, ""longtermDebtTotalAsset"": 0.2173, ""longtermDebtTotalCapital"": 0.2548, ""longtermDebtTotalEquity"": 0.3563, ""netDebtToTotalCapital"": 0.2222, ""netDebtToTotalEquity"": 0.3107, ""netMargin"": 0.2383, ""operatingMargin"": 0.2843, ""payoutRatioTTM"": 0.0952, ""pb"": 3.0604, ""peTTM"": 17.6516, ""pfcfTTM"": 50.1954, ""pretaxMargin"": 0.3028, ""psTTM"": 8.8635, ""ptbv"": 5.6773, ""quickRatio"": 0.9002, ""receivablesTurnoverTTM"": 7.5761, ""roaTTM"": 0.1096, ""roeTTM"": 0.1844, ""roicTTM"": 0.1296, ""rotcTTM"": 0.0733, ""salesPerShare"": 14.257, ""sgaToSale"": 0.3031, ""tangibleBookValue"": 9027.1, ""totalDebtToEquity"": 0.3981, ""totalDebtToTotalAsset"": 0.2428, ""totalDebtToTotalCapital"": 0.2847, ""totalRatio"": 2.5629, ""period"": ""2023-06-30""}"
25,2023-07-02,478.7523498535156,2023-07-09,475.061279296875,-0.0077097701092642135,D1,"[{""date"": ""20230702020000"", ""headline"": ""10 Safest Dividend Aristocrats For 2023"", ""summary"": ""Looking for stock market analysis and research with proves results? Zacks.com offers in-depth financial research with over 30years of proven results.""}, {""date"": ""20230702040145"", ""headline"": ""Dividend Champion, Contender, And Challenger Highlights: Week Of July 2"", ""summary"": ""A weekly summary of dividend activity for Dividend Champions, Contenders, and Challengers. Click here to read more.""}, {""date"": ""20230703113000"", ""headline"": ""Here's Why Roper (ROP) Deserves a Place in Your Portfolio"", ""summary"": ""Strength across the Application Software segment due to growth in Deltek, Vertafore and Aderant businesses augurs well for Roper (ROP). The Frontline acquisition bolsters the company's growth.""}, {""date"": ""20230703184015"", ""headline"": ""10 Best July Dividend Stocks To Buy"", ""summary"": ""In this article, we discuss 10 best July dividend stocks to buy. You can skip our detailed analysis of dividend capture strategy and performance of dividend stocks, and go directly to read 5 Best July Dividend Stocks To Buy. The investment landscape is undergoing substantial shifts this year as investors explore different strategies to make [\u2026]""}, {""date"": ""20230705060000"", ""headline"": ""Rare Buy Picks In June 2023 - From 34 Discerning Analysts"", ""summary"": ""We've compiled a list of June Investment Picks that you may have missed. The investment ideas featured here are from Analysts who made no previous Buy recommendations in Q2.""}, {""date"": ""20230705124800"", ""headline"": ""Roper Technologies Inc. stock outperforms competitors despite losses on the day"", ""summary"": ""Shares of Roper Technologies Inc. shed 0.09% to $476.97 Wednesday, on what proved to be an all-around dismal trading session for the stock market, with the...""}, {""date"": ""20230705200000"", ""headline"": ""Roper Technologies, Inc. Primary Exchange Listing will Change to Nasdaq Global Select from New York Stock Exchange"", ""summary"": ""Effective July 06, 2023, Roper Technologies, Inc. primary exchange listing will change to Nasdaq Global Select from New York Stock Exchange....""}, {""date"": ""20230706053103"", ""headline"": ""U.S. Wide-Moat Stocks On Sale - The July 2023 Heat Map"", ""summary"": ""Our 3-step process focuses on wide-moat stocks. We're only interested in targets attractively valued in historical comparison. Read what investors need to know.""}, {""date"": ""20230706053500"", ""headline"": ""(ROP) - Analyzing Roper Techs's Short Interest"", ""summary"": ""Looking for stock market analysis and research with proves results? Zacks.com offers in-depth financial research with over 30years of proven results.""}, {""date"": ""20230706235900"", ""headline"": ""3 Safe Dividend Aristocrats With Recession-Proof Payouts"", ""summary"": ""Looking for stock market analysis and research with proves results? Zacks.com offers in-depth financial research with over 30years of proven results.""}]","{""assetTurnoverTTM"": 0.2182, ""bookValue"": 16745.9, ""cashRatio"": 0.529252143709975, ""currentRatio"": 0.9429, ""ebitPerShare"": 4.0531, ""eps"": 3.3976, ""ev"": 56452.847, ""fcfMargin"": 0.1927, ""fcfPerShareTTM"": 9.5679, ""grossMargin"": 0.6969, ""inventoryTurnoverTTM"": 16.6489, ""longtermDebtTotalAsset"": 0.2173, ""longtermDebtTotalCapital"": 0.2548, ""longtermDebtTotalEquity"": 0.3563, ""netDebtToTotalCapital"": 0.2222, ""netDebtToTotalEquity"": 0.3107, ""netMargin"": 0.2383, ""operatingMargin"": 0.2843, ""payoutRatioTTM"": 0.0952, ""pb"": 3.0604, ""peTTM"": 17.6516, ""pfcfTTM"": 50.1954, ""pretaxMargin"": 0.3028, ""psTTM"": 8.8635, ""ptbv"": 5.6773, ""quickRatio"": 0.9002, ""receivablesTurnoverTTM"": 7.5761, ""roaTTM"": 0.1096, ""roeTTM"": 0.1844, ""roicTTM"": 0.1296, ""rotcTTM"": 0.0733, ""salesPerShare"": 14.257, ""sgaToSale"": 0.3031, ""tangibleBookValue"": 9027.1, ""totalDebtToEquity"": 0.3981, ""totalDebtToTotalAsset"": 0.2428, ""totalDebtToTotalCapital"": 0.2847, ""totalRatio"": 2.5629, ""period"": ""2023-06-30""}"
26,2023-07-09,475.061279296875,2023-07-16,476.27783203125,0.00256083328065726,U1,"[{""date"": ""20230711071100"", ""headline"": ""Roper Technologies Achieves #102 Analyst Rank, Surpassing General Dynamics"", ""summary"": ""Looking for stock market analysis and research with proves results? Zacks.com offers in-depth financial research with over 30years of proven results.""}, {""date"": ""20230711072600"", ""headline"": ""Video: S&P 500 Analyst Moves: ROP"", ""summary"": ""Looking for stock market analysis and research with proves results? Zacks.com offers in-depth financial research with over 30years of proven results.""}, {""date"": ""20230711090400"", ""headline"": ""DAT introduces new tools to help the freight industry fight fraud"", ""summary"": ""BEAVERTON, Ore., July 11, 2023--DAT Freight & Analytics today introduced new initiatives to reduce the risk of fraud and double brokering in the industry while delivering the speed, convenience and open marketplace users expect from the DAT One truckload freight network.""}, {""date"": ""20230712014500"", ""headline"": ""Akre Focus Fund Second Quarter 2023 Commentary"", ""summary"": ""Akre Focus Fund\u00e2\u0080\u0099s Q2 2023 performance for the Institutional share class was 8.62% vs. S&P 500 Total Return at 8.74%. Click here to read the full fund letter.""}, {""date"": ""20230712040000"", ""headline"": ""Will AIP Drive Enough Demand Growth To Justify Palantir's Valuation?"", ""summary"": ""Palantir is going to need a major jolt from its U.S. AI business to reverse its growth deceleration trend. Find out why PLTR stock is a Sell.""}, {""date"": ""20230712100000"", ""headline"": ""Navy Mutual Launches Innovative Technology from iPipeline\u00ae to Automate, Streamline, and Enhance Its Underwriting and New Business Processes"", ""summary"": ""iPipeline\u00ae announces that Navy Mutual Aid Association, the nation's oldest federally recognized Veterans Service Organization, recently launched its Resonant\u00ae multi-functional solution for underwriting and new business which will accelerate those processes for the insurer's life insurance and annuity products.""}, {""date"": ""20230713045000"", ""headline"": ""Analysts Offer Insights on Industrial Goods Companies: Roper Technologies (ROP) and WillScot Mobile Mini Holdings (WSC)"", ""summary"": ""Looking for stock market analysis and research with proves results? Zacks.com offers in-depth financial research with over 30years of proven results.""}, {""date"": ""20230713073600"", ""headline"": ""If You Invested $1000 In This Stock 10 Years Ago, You Would Have $3,700 Today"", ""summary"": ""Looking for stock market analysis and research with proves results? Zacks.com offers in-depth financial research with over 30years of proven results.""}, {""date"": ""20230713125800"", ""headline"": ""Can Roper (ROP) Retain Beat Streak This Earnings Season?"", ""summary"": ""Roper's (ROP) Q2 earnings are expected to have benefited from robust customer demand and a strong pipeline of orders. However, supply chain issues and cost inflation might have weighed on performance.""}, {""date"": ""20230713210200"", ""headline"": ""Earnings week ahead: Tesla, Netflix, Johnson & Johnson, Bank of America and more"", ""summary"": ""Looking for stock market analysis and research with proves results? Zacks.com offers in-depth financial research with over 30years of proven results.""}, {""date"": ""20230714103314"", ""headline"": ""Roper Technologies: High Recurring Vertical Software Franchise With Multi-Year Portfolio Optimization"", ""summary"": ""Despite some slower customer demands at Deltek, Roper is targeting double-digit sales growth. Read more to see why I recommend a 'Buy' rating for ROP stock.""}, {""date"": ""20230716060446"", ""headline"": ""Dividend Champion, Contender, And Challenger Highlights: Week Of July 16"", ""summary"": ""A weekly summary of dividend activity for Dividend Champions, Contenders, and Challengers. Companies with upcoming ex-dividend dates. Click here to read more.""}]","{""assetTurnoverTTM"": 0.2182, ""bookValue"": 16745.9, ""cashRatio"": 0.529252143709975, ""currentRatio"": 0.9429, ""ebitPerShare"": 4.0531, ""eps"": 3.3976, ""ev"": 56452.847, ""fcfMargin"": 0.1927, ""fcfPerShareTTM"": 9.5679, ""grossMargin"": 0.6969, ""inventoryTurnoverTTM"": 16.6489, ""longtermDebtTotalAsset"": 0.2173, ""longtermDebtTotalCapital"": 0.2548, ""longtermDebtTotalEquity"": 0.3563, ""netDebtToTotalCapital"": 0.2222, ""netDebtToTotalEquity"": 0.3107, ""netMargin"": 0.2383, ""operatingMargin"": 0.2843, ""payoutRatioTTM"": 0.0952, ""pb"": 3.0604, ""peTTM"": 17.6516, ""pfcfTTM"": 50.1954, ""pretaxMargin"": 0.3028, ""psTTM"": 8.8635, ""ptbv"": 5.6773, ""quickRatio"": 0.9002, ""receivablesTurnoverTTM"": 7.5761, ""roaTTM"": 0.1096, ""roeTTM"": 0.1844, ""roicTTM"": 0.1296, ""rotcTTM"": 0.0733, ""salesPerShare"": 14.257, ""sgaToSale"": 0.3031, ""tangibleBookValue"": 9027.1, ""totalDebtToEquity"": 0.3981, ""totalDebtToTotalAsset"": 0.2428, ""totalDebtToTotalCapital"": 0.2847, ""totalRatio"": 2.5629, ""period"": ""2023-06-30""}"
